,restaurant,restaurant_id,rating,text,time_created
2198,La Boucherie,QKNCjonKZ8OkfbCD_j7JHA,4,Was able to snag a last minute reservation a night before my boyfriend's birthday! We changed his mind from going to Mastro's to coming to La Boucherie....,2019-04-05 23:17:23
2199,La Boucherie,QKNCjonKZ8OkfbCD_j7JHA,5,"We ate at La Boucherie on Tuesday night and ordered the Dine LA menu. It's a special 5 course menu.

First of all, we sat in one of the 3 Starlight booths...",2019-02-18 14:52:15
2200,Waku Waku Sakebar,gEZzvxvK0VtlTXQKelsSxw,5,"Oh wow. My first time here and I already love it. 

Fast.
Flavorful.
Friendly.
And another F word I can't think of...

Wow.

I got the poke bowl. This bowl...",2018-11-06 17:18:05
2201,Waku Waku Sakebar,gEZzvxvK0VtlTXQKelsSxw,3,"I'm torn. I did large orders two days in a row for work. 

The first experience was fast and friendly and worth every penny. They even helped me carry the...",2018-10-26 18:00:02
2202,Waku Waku Sakebar,gEZzvxvK0VtlTXQKelsSxw,4,Stopped into this place after shopping at Amoeba Music across the street. Free miso soup with check in! The servers were great! Very friendly and on the...,2019-03-28 21:39:48
2203,Pour Haus Wine Bar,c2QZmOUhNm8rB1L-XvCvcQ,5,"My boyfriend and I came for some some late night munchies. We got the snack plate with salami & ""cow girl"" stinky cheese (SO GOOD)!!! 

TRY THE CANDIED...",2019-03-16 12:01:49
2204,Pour Haus Wine Bar,c2QZmOUhNm8rB1L-XvCvcQ,4,"Yelp 100 Challenge 2019 #14

So I want to give this place 5-stars, but I came here for an event, so I can't speak on how an actual dining/drinking...",2019-03-12 20:33:03
2205,Pour Haus Wine Bar,c2QZmOUhNm8rB1L-XvCvcQ,5,"What a great find! We had just eaten lunch at Pearl's BBQ and were looking for a brewery or wine bar nearby and found the Pour Haus only a block away, so...",2019-02-26 17:02:17
2206,Kues Restaurant,clajFGFea-zmi-CzZgEL8A,5,"Happy Hour is so on point Kues!

Their dimsum is a must (especially the ha gao which is the shrimp encased in a slightly translucent wrap) 
Best dimsum in...",2019-03-16 21:54:05
2207,Kues Restaurant,clajFGFea-zmi-CzZgEL8A,3,Can only describe my lunchtime pickup order which I used through the Ritual app. I had been hearing in local food blogs about Kues and had been intrigued...,2019-03-22 09:00:01
2208,Kues Restaurant,clajFGFea-zmi-CzZgEL8A,5,"The service, drinks, and food here are second to none. Marcus (the owner) treats us like family! Most recently, he prepared items for us that were off menu:...",2019-02-27 21:11:45
2209,La Cocinita,lfYZj35tFbnHwgLFyPTKqQ,5,We happened to be in LA today and where looking for a authentic Salvadorian food. We came upon this place and I have to say the food is excellent and very...,2019-02-18 17:55:47
2210,La Cocinita,lfYZj35tFbnHwgLFyPTKqQ,5,"Yummy. Great prices, delicious food. This a simple place, mom and pop type of place. The staff are friendly.",2019-02-17 12:13:49
2211,La Cocinita,lfYZj35tFbnHwgLFyPTKqQ,5,"Affordable, and very flavorful. It's a counter service restaurant and it's not in the best area, but I had a full and tasty meal for under 10 dollars!",2018-12-18 13:03:07
2212,Kiku Sushi,KQ8surQGsdsUpjLoVMUW-A,5,"I love this place. 
The service is terrific. 
The food is superb!  Always fresh. 
They are fast and kind.",2019-04-01 00:26:33
2213,Kiku Sushi,KQ8surQGsdsUpjLoVMUW-A,3,"We enjoyed our sushi dinner. 
Had high expectations on the blue crab salmon roll and it was a disappointment. 
It had an odd taste (I think it was the...",2019-03-05 18:40:59
2214,Kiku Sushi,KQ8surQGsdsUpjLoVMUW-A,5,"Kikumazing. Fresh fish. Hot sake. Cold beer. Friendly service. Parking in rear.
What else do you need?
Top it off with ice cream mochi. Amazing!",2019-02-07 18:06:00
2215,Hong Kong Ban Jum 0410 / Paik's Noodle,WWQsHGIFUkNQF6Uaj4vXCw,5,"I went to this place with my sister and I really liked it.

We ordered jaengban jjajang and yuringi which is made with chicken. Both of them were really...",2019-03-02 22:02:27
2216,Hong Kong Ban Jum 0410 / Paik's Noodle,WWQsHGIFUkNQF6Uaj4vXCw,4,Their Jjajangmyun (black bean noodles) is very good but their Jjamppong (Spicy seafood noodles) is amazing!  Their portions are generous and the service is...,2019-03-04 18:51:20
2217,Hong Kong Ban Jum 0410 / Paik's Noodle,WWQsHGIFUkNQF6Uaj4vXCw,4,"Decent black bean noodles, but their tangsooyook is to die for!

Hong Kong Ban Jum is a chain restaurant owned by a pretty well-known chef in Korea. With...",2019-03-03 17:59:05
2218,Jae Bu Do,WQqFyF6FxTVRojoSN4Nljw,4,"Sick of your traditional Korean BBQ and a seafood fan? You have to check out Jae Bu Do where the seafood BBQ is fantastic. At first glance, the restaurant...",2019-02-25 09:57:01
2219,Jae Bu Do,WQqFyF6FxTVRojoSN4Nljw,3,If you want to come here during weekend be prepared to use their valet service or park on the jam packed street. The seafood seems pretty fresh and they...,2019-04-07 18:07:41
2220,Jae Bu Do,WQqFyF6FxTVRojoSN4Nljw,4,"Very unique dining experience! Despite the ubiquity of Korean (beef and pork) BBQ, this was my first encounter with Korean seafood BBQ, which is...",2019-02-23 12:18:13
2221,Little Kingston Jamaican Restaurant,Uciy4a2wODubfq24noRRag,5,This place is amazing. I was a big fan of wi Jammin but once I found this place. I was in heaven. The Customer service is excellent. The Price is reasonable...,2018-12-13 18:30:48
2222,Little Kingston Jamaican Restaurant,Uciy4a2wODubfq24noRRag,2,"I try not to give a review with nothing positive to say, but there was nothing good about my oxtails meal. 

The plantains tasted old like they have been...",2019-03-24 18:27:52
2223,Little Kingston Jamaican Restaurant,Uciy4a2wODubfq24noRRag,4,Our first time here and the food was very good and well seasoned. I ordered oxtail and my husband ordered curry chicken.  He wanted curry goat but they were...,2018-11-12 20:29:27
2224,Bacari W 3rd,y2eWXL2qbTW8tXyrEsfEqQ,5,I love love love the ambience in the place! You walk through a tunnel and then walk into the outdoor area of the restaurant. It definitely gave me a WOW...,2019-04-02 08:57:20
2225,Bacari W 3rd,y2eWXL2qbTW8tXyrEsfEqQ,4,"Really nice, open, large space/patio for brunch dining in great weather. All of their items are brunch tapas style, which is great for sharing. We had a...",2019-04-01 17:06:36
2226,Bacari W 3rd,y2eWXL2qbTW8tXyrEsfEqQ,5,We loved this place! Came here for brunch and sat on the patio. It is super cute. We shared a bunch of plates and they were all good. The portions are small...,2019-03-30 13:01:33
2227,Isaan Station Thai Street Food,Q-7u7kPhVeGYV8DdKbj02A,5,I can't give more love to this place! This is the place that Thai people usually go to. Fresh ingredients and good service. But beware cash only. They have...,2019-04-07 20:04:17
2228,Isaan Station Thai Street Food,Q-7u7kPhVeGYV8DdKbj02A,5,I was craving Thai food and looked Thai food on yelp. I decided on Saab Station. I ordered off yelp and they had it ready a couple minutes prior than...,2019-02-21 12:49:55
2229,Isaan Station Thai Street Food,Q-7u7kPhVeGYV8DdKbj02A,5,"This place is a real deal! We are regular here. The food is so good and just bring me back to Thailand.

It's like one of the places that the Thai people...",2019-02-16 15:19:08
2230,Froma on Melrose,mIfBPK5arg4jAtwBytioZg,5,I heard about this place through my son who works down the street. I must say this place is quite the little cozy noon. The menu is comprised of lite...,2019-03-26 17:09:36
2231,Froma on Melrose,mIfBPK5arg4jAtwBytioZg,4,"I went here a few weeks ago with a friend of mine from Italy who is a freakish nut job when it comes to coffee, especially espresso! Oh the rants she goes...",2019-03-06 16:18:41
2232,Froma on Melrose,mIfBPK5arg4jAtwBytioZg,4,"My husband and came here on a Friday and when we walked in we were immediately greeted by the mingling smells of butter and a pizza oven, which sent me back...",2018-11-17 10:01:23
2233,Mountain Cafe,et-BaxAfGLpTufqfimbPUg,5,I've been coming here since way back in the day when it was a hole in the wall on 8th street.  It's nice that it's in this much more visible location with...,2019-03-13 14:43:25
2234,Mountain Cafe,et-BaxAfGLpTufqfimbPUg,4,"I love this restaurant but hate the lack of parking in their new location. If you want homey Korean comfort food, this is the place. They are known for...",2019-03-14 22:26:57
2235,Mountain Cafe,et-BaxAfGLpTufqfimbPUg,2,Sub par Korean food. It was pretty cheap but you seriously get what you pay for. My boyfriend got the seaweed seafood soup and it had only 3 shrimp pieces...,2019-02-22 05:10:17
2236,Pink Taco,fCzDsLfL5yvlGragBwV40A,5,"I can now update this review based on dining in the restaurant rather than just delivery and let me just say, it was even better in person. 

Pink Taco has...",2019-04-01 21:07:37
2237,Pink Taco,fCzDsLfL5yvlGragBwV40A,4,"My go to taco spot on Sunset. The staff are super friendly, and professional. Fun vibe with awesome food and drinks. 

Our server was super attentive,...",2019-03-24 17:58:45
2238,Pink Taco,fCzDsLfL5yvlGragBwV40A,2,"We've been here many times, however, always the exact same thing. 

Food: Great

Service: Ish

Cleanliness: Could be cleaner

$42 house margaritas: Ha ha,...",2019-03-23 18:29:48
2239,The Apple Pan,odzvOMZgp0OVYGp9sDS3qQ,4,"Old fashioned counters 
Men over 50 who cook 
Cash only, homie. 

Hickory Burger - so good. 
Tillamook cheddar in my hood. 
Limited seats, we stood. 

Pecan...",2019-04-07 20:19:44
2240,The Apple Pan,odzvOMZgp0OVYGp9sDS3qQ,5,"Video Review: https://youtu.be/Sj7BCl1APBA

Oh boy you are in for a mouth treat with this segment where we go meat deep into the historic Apple Pan in Los...",2019-04-04 11:23:16
2241,The Apple Pan,odzvOMZgp0OVYGp9sDS3qQ,3,"Eater LA bought me here although I live a couple miles away. I had to try them out to see what all the hype was about. Due to the way seating is, no there...",2019-04-03 20:40:21
2242,Oo-Kook Korean BBQ,gvOwLa57365ElddwcUhIyw,5,"First time coming here, but I have heard so many good things about it!  They have all the cuts of meat that you would want from a KBBQ spot, and the staff...",2019-04-02 09:06:05
2243,Oo-Kook Korean BBQ,gvOwLa57365ElddwcUhIyw,2,"Seriously? The food is pretty standard for KBBQ. I have been here multiple times with my husband and friends, we always spend $600+.
Tonight, our group was...",2019-03-30 22:20:55
2244,Oo-Kook Korean BBQ,gvOwLa57365ElddwcUhIyw,5,"Yum yum yum! Price was very reasonable for everything you can eat in 90 minutes. Staff was very attentive and quick. Had a great time with my cousin! 

Pork...",2019-03-29 23:57:17
2245,Zankou Chicken,lAmpZfYijXT5fcc1Zqy4Nw,5,"Always so good! Quick, healthy meal. 
I was starving today and I got the beef shawarma meal with hummus, baba ganoush, pickled turnips, salad, pita and my...",2019-03-10 20:16:47
2246,Zankou Chicken,lAmpZfYijXT5fcc1Zqy4Nw,2,"Food is really great, don't get me wrong!  Service people are typically super nice and the place is clean.  Parking can be a jam if you come during weekday...",2019-04-07 20:16:55
2247,Zankou Chicken,lAmpZfYijXT5fcc1Zqy4Nw,3,"Low rating because I found the rotisserie chicken to be bland. Yes, there was no seasoning on that chicken!

I expect well seasoned meat at a Mediterranean...",2019-03-15 10:37:46
2248,Te'Kila,E-1cbKvH1nv9sKxrFIM1bg,5,"We where trying to find a place to eat dinner on Friday night and we looked on yelp and it suggested this place . 
Let me tell you it was perfect!
Not only...",2019-03-31 10:05:16
2249,Te'Kila,E-1cbKvH1nv9sKxrFIM1bg,5,"I love Tequilas !!!! First off MY BOYS Derrick, Dave, and Seth!!!!! Always are the best !!!!! I'm on the KETO DIET and they made that work for me! I ordered...",2019-02-08 21:31:50
2250,Te'Kila,E-1cbKvH1nv9sKxrFIM1bg,5,"Wandered in by mistake, was going to go to Rita's, but stayed because of the MUSIC.  A three piece band playing covers and Spanish favorites, ripping on the...",2019-01-22 13:03:21
2251,Pho Legend,WCm7p2IlHG9_eEWNjiKAJQ,4,Very rare would you find a decent pho place that is under $10 in LA. At Pho Legend it's a fairly cheaper price compared to most overly priced places. Inside...,2019-03-31 11:56:27
2252,Pho Legend,WCm7p2IlHG9_eEWNjiKAJQ,5,"A Five Star review from MY point of view houses the full establishment. 

From the very clean look of the place and the soft music late night ambiance to...",2019-03-18 16:44:37
2253,Pho Legend,WCm7p2IlHG9_eEWNjiKAJQ,3,"I usually wouldn't go to a pho restaurant when i'm visiting LA, but my friends were hungover AF and needed some soupy noodz for the cure. We found this...",2019-03-04 16:26:57
2254,The Parlor,xUDJy8BuzZou2BADrkZBPw,4,"Had a great time. Drinks can be a little pricey, but the worst part for me was standing at the bar to order a drink and there was no one behind the bar. No...",2019-03-31 11:22:35
2255,The Parlor,xUDJy8BuzZou2BADrkZBPw,5,"Love the Parlor!!! Anthony is the best bouncer!!! Good Food, always... Been here for many sporting events.. Back in the day when The West Wing was hosting...",2019-03-03 15:35:04
2256,The Parlor,xUDJy8BuzZou2BADrkZBPw,3,"Staple sports bar in the area. It's a designated Jayhawks bar, so it's my go-to. I always like to reserve in advance and you can give notes of where you...",2019-01-14 20:13:17
2257,Shin Chon Seolnongtang,u5v6CeUG286gUP1bmGs9Qw,5,"Their mixed veggie and beef stew in spicy is sooo good, but very spicy haha. I recommend it slightly spicy. Good chunks of veggies and hearty.

Tip: one of...",2019-02-09 19:16:17
2258,Shin Chon Seolnongtang,u5v6CeUG286gUP1bmGs9Qw,4,"I came here with a friend for dinner with a friend during a cold day and came here after seeing their hot soup with meat fish. 

And here is the...",2019-01-27 19:44:03
2259,Shin Chon Seolnongtang,u5v6CeUG286gUP1bmGs9Qw,4,"The kimchi and beef soup is just ok. Some of the beef in the beef soup is not fresh and they change it for me immediately. The new one is much better,...",2018-11-14 21:37:07
2260,Souffles,_5TyYb39hhvo9v7seB7V6A,4,"Not a huge fan of their prices ($12.95 for a flavored pancake souffle), but I will say my Ube Souffle Pancake was Ah-maze-inggg. Super light and fluffy, and...",2019-04-07 23:59:36
2261,Souffles,_5TyYb39hhvo9v7seB7V6A,5,"I still crave the incredibly yummy souffle pancakes!!! Soft, airy, fluffy pancakes.  All i can say is delicious doesnt even begin to describe them! 

This...",2019-04-07 07:55:06
2262,Souffles,_5TyYb39hhvo9v7seB7V6A,4,"This place was so adorable! Too bad we went looking super messy, couldn't take any cute pictures  the decor is very bright & trendy! It was kind of...",2019-04-01 09:38:45
2263,Coconut's Fish Cafe,XjmMhxMTwm6NdxHiLlKC0Q,5,"My fiancé is extremely sick of me saying ""When do you think Coconuts will open back up?"" He actually banned me from mentioning Coconut's lol. 

Needless to...",2019-03-29 13:56:26
2264,Coconut's Fish Cafe,XjmMhxMTwm6NdxHiLlKC0Q,5,I first tried Coconut's Fish Cafe in Maui and was so excited when they opened one here in DTLA! They did not disappoint. Hawaiian vibes remained the same....,2018-10-15 13:40:38
2265,Coconut's Fish Cafe,XjmMhxMTwm6NdxHiLlKC0Q,5,"The five stars is based on my experience with their location in Kihei, Hawaii on the Maui island. If this location is anywhere close as good this will be an...",2019-04-01 12:59:43
2266,Jesse Boy,Jd_1ZFglF0Kqqp0WGHyPeg,5,"Amazing! I'm writing this after gorging my me Gotta get the spicy chicken tenders, it's a family Korean recipe and it's delicious. Make sure you squeeze the...",2019-03-23 21:10:42
2267,Jesse Boy,Jd_1ZFglF0Kqqp0WGHyPeg,4,"Delicious KFC with tasty salads to boot. 
I have tried the wings and tenders here, and the cook on the chicken is spot on. 
Tenders are juicy and crisp, and...",2019-03-06 20:38:16
2268,Jesse Boy,Jd_1ZFglF0Kqqp0WGHyPeg,3,"When you've got a menu this tiny, better make sure everything on it is on point. Generally, I find that this is the case - the less food a restaurant tries...",2019-03-04 13:08:36
2269,Taix French Restaurant,Fcxm2Wnz8lLDi6doGcAMTw,5,"2019 DineLA #4: January Winter Edition - $39 Dinner Menu.
By far, this has been my absolute favorite DineLA Dinner Menu for Taix. Bravo Taix, bravo!!!

This...",2019-01-20 16:14:03
2270,Taix French Restaurant,Fcxm2Wnz8lLDi6doGcAMTw,1,I had dinner with my friend here on Monday night. I love Taix I've been here numerous times. The first time I came here was when I was in the French club in...,2019-03-26 20:33:21
2271,Taix French Restaurant,Fcxm2Wnz8lLDi6doGcAMTw,3,"Very fresh, soft, clean, flavourful mussels. Is it mussel season?
Escargot not perfect, but not too bad. Froglegs are flavourless, they looked fried but I...",2019-01-12 19:12:39
2272,Mister O's,ma3MRxILFJZW9Ffr3CkAcQ,5,"Mister O's is a great place for a date night or a group outing. Love the decor and atmosphere. 

The drinks are delicious and thoughtfully made. The food is...",2019-03-17 22:20:24
2273,Mister O's,ma3MRxILFJZW9Ffr3CkAcQ,2,I really don't see what all the fuss is about. I found this place to be overrated. Each dish is so pretentious with way too many ingredients. I know...,2019-03-26 11:48:12
2274,Mister O's,ma3MRxILFJZW9Ffr3CkAcQ,4,"Three times' a charm for Mister O's. Every visit has been a total palate pleaser. Their cocktail program is sophisticated, the ambiance is lovely, and the...",2019-03-25 12:39:49
2275,Birds Rotisserie Chicken Cafe & Bar,ubAiG5pgaQazJpoFHfViMg,5,"Chicken chicken chicken. Who doesn't love chicken. And this place does it right. 

We ordered the Appetizer Sampler (Curley Fries, Buffalo Chicken Tenders...",2019-02-09 10:57:37
2276,Birds Rotisserie Chicken Cafe & Bar,ubAiG5pgaQazJpoFHfViMg,3,"A lovely dark place, and quite cozy, with comfy booths and niches you can wedge yourself in for the duration, so that's a good thing, right? If I were in...",2019-04-04 19:12:40
2277,Birds Rotisserie Chicken Cafe & Bar,ubAiG5pgaQazJpoFHfViMg,3,"This neighborhood bar-restaurant serves a few labeled vegan items: a bean salad, a homemade BBQ veggie burger and the Impossible burger.

We got the bean...",2019-03-09 18:26:15
2278,Alchemist Coffee Project,ZxFQnp-PidPRTf23Ss_ecA,5,"This place has great coffee. I had their Kyoto drip cold brew, and it was very tasty! Felt the cold brew had a nice little choco taste with a bit of nutty...",2019-04-01 13:49:04
2279,Alchemist Coffee Project,ZxFQnp-PidPRTf23Ss_ecA,4,"Really enjoyed my visit to this coffee shop. I ran here for a quick bite and cup of coffee in between business meetings and was delighted. 

I got a cold...",2019-03-30 16:51:49
2280,Alchemist Coffee Project,ZxFQnp-PidPRTf23Ss_ecA,5,"YES!
We made an impromptu visit here while traveling up Vermont & i'm so glad we did!
It's a bit pretentious on the outside BUT warm and inviting on the...",2019-03-27 08:49:07
2281,Hakata Ikkousha,wj6x4qDuTwjZGH7jdPLr5A,5,"Parking: Street or paid lot

Ambiance: Casual

Service: Friendly like all Ramen spots

Price: Reasonable and worth it!

Food: By far one of my favorite...",2019-04-01 00:32:58
2282,Hakata Ikkousha,wj6x4qDuTwjZGH7jdPLr5A,3,We came to Hakata Ikkousha because every other spot in Little Tokyo that has vegan ramen usually has an obnoxious 45-minute wait on a cramped sidewalk (I'm...,2019-04-07 15:18:50
2283,Hakata Ikkousha,wj6x4qDuTwjZGH7jdPLr5A,5,"This place has the best ramen I have every tasted thus far. Nothing in Arizona  can compare to this place. 
The flavor of the broth, the perfect texture of...",2019-03-18 20:55:42
2284,The Potato Sack,ucRSCJw-2vzD8QrPYXcdYA,5,"Enjoyed every bite 
Good
Good
Good
Good
Good
Good
Good
Good
Good
Good
Good
Good
Good
Good",2019-04-06 14:14:44
2285,The Potato Sack,ucRSCJw-2vzD8QrPYXcdYA,5,"So I've been ordering from here for months but this was the first time I actually stepped into the restaurant. 

It is in a small shopping center and hidden...",2019-03-27 11:21:08
2286,The Potato Sack,ucRSCJw-2vzD8QrPYXcdYA,4,Love that The Potato Sack is walking distance from where I live. I finally caved and order eggs Benedict to go and some French toast. When we arrived to...,2019-03-18 11:28:51
2287,Indimex Eats,5MORxFcPj3u1D9Jp1AZj4A,5,"We were not expecting much at all! As a family we like to have ""adventures"" trying new food places knowing we risk it being a fail. But THIS WAS OUR BIGGEST...",2019-02-15 20:48:51
2288,Indimex Eats,5MORxFcPj3u1D9Jp1AZj4A,5,"Wow! This was soooo GOOD and we
Ordered delivery! It's hard enough
To find good food in LA, but even harder to be happy with your delivery. We ordered the...",2018-12-06 23:35:24
2289,Indimex Eats,5MORxFcPj3u1D9Jp1AZj4A,5,"Definitely found my fav Indian restaurant in LA! So good and so cheap, compared to most Indian restaurants. Honestly, it taste more like Indian food than...",2018-11-19 19:45:26
2290,Umeda,vu8S4ESHmqWnoVT80lbnUg,5,"I love Umeda. We've been there almost like a month ago for the first time, everythings was delicious.
I loved the sushi btw ikura was killing it. Soo...",2019-02-18 16:51:58
2291,Umeda,vu8S4ESHmqWnoVT80lbnUg,5,Had an awesome lunch at Umeda. My friend and I ordered two different lunch specials so we could share and try more. I had the chicken curry and sashimi...,2019-02-16 20:43:42
2292,Umeda,vu8S4ESHmqWnoVT80lbnUg,2,"**This review only pertains to the $150 omakase tasting menu**

Summary:  supremely overpriced ($195 per person including tax and tip) for a mostly...",2019-01-16 10:58:51
2293,Jaragua,lYfTKG3uhA5m4coAqWu4ng,5,"Took a group of friends here and everyone really enjoyed it.
It's a very spacious and clean restaurant.  Service is on point here and we got all our food in...",2018-11-19 15:53:54
2294,Jaragua,lYfTKG3uhA5m4coAqWu4ng,3,"This was my third time going to this restaurant. 
I was satisfied with my meal, but I took my dad out to eat this time. As soon as we left he told me his...",2018-12-17 08:40:14
2295,Jaragua,lYfTKG3uhA5m4coAqWu4ng,4,I still wished that Yelp would allow a half star option cause I would give this place a 4.5. This place has many bonuses that other Salvadorian restaurant...,2019-03-13 11:00:34
2296,Neri's,eIip70AtYPjJsC4kh1uTjg,5,"What a great casual Filipino restaurant!  Not only is the food great, the people are so nice here that I never want to leave.  My favorite is the Crispy...",2018-12-07 18:17:33
2297,Neri's,eIip70AtYPjJsC4kh1uTjg,3,"writing bout taste and value.
ordered longanisa and vegetable lumpia. 

disappointed. longanisa resembled hotdogs, even the taste. all the longsnisa I've...",2019-03-24 15:38:47
2298,Neri's,eIip70AtYPjJsC4kh1uTjg,4,"Food was good. Had their Lechon Kawali with rice ($8.95). The pork belly was crispy, although some of the skins were chewy. Overall still very good though....",2019-03-19 14:18:17
2299,El Flamin' Taco,QmkcjISaVPchFil1BTxrtQ,5,Omfg.... the al pastor is michelin star quality .. worth the trek alone... i also tried the beef cheek... excelllent but i needed some toppings... best...,2019-03-24 22:05:38
2300,El Flamin' Taco,QmkcjISaVPchFil1BTxrtQ,5,"I don't care what anyone says, but this taco truck has the best al pastor in the county. I've been here at least 75 times and it's never disappointed. I...",2019-03-18 20:54:38
2301,El Flamin' Taco,QmkcjISaVPchFil1BTxrtQ,4,"If you like al pastor, El Flamin' is arguably one of the best!  I highly recommend their al pastor taco and burrito.

To top it all off, the price is as...",2019-02-28 22:43:38
2302,Dollar Hits,pxg3VJKR9sA7cJqgXFTrSw,4,"My boyfriend and i had our valentines dinner here, we had a filipino street food craving so we decided to stop by.


I love how its $1 a stick and UNLIMITED...",2019-02-19 14:39:53
2303,Dollar Hits,pxg3VJKR9sA7cJqgXFTrSw,4,"As the name states, most things are $1! Very interesting Filipino street food experience since the food is already cooked, but after you buy it, you can...",2019-01-01 10:49:09
2304,Dollar Hits,pxg3VJKR9sA7cJqgXFTrSw,4,"Three Words: Filipino Street Food!

It's basically like the Filipino version of Yakitori,
which are meats on a stick and grilled.

You go inside and grab...",2018-11-13 14:21:56
2305,Natalie Peruvian Seafood Restaurant,SC8JygWEEGXCmykQrfdHzg,4,"This places deserves more attention by people. Everyone here are so friendly and the food was bomb dot com!

Lomo Saltado is a must get if you like your...",2019-03-04 11:52:13
2306,Natalie Peruvian Seafood Restaurant,SC8JygWEEGXCmykQrfdHzg,4,"I was craving Peruvian food. This place is close to my church and it has good reviews so I decided to try it.

The place is really small, luckily two people...",2019-03-04 09:09:20
2307,Natalie Peruvian Seafood Restaurant,SC8JygWEEGXCmykQrfdHzg,5,"Natalie is my Sunday go-to. 

Every time I visit my wife's family we come here for lunch. 

I recommend the lomo saltado and choros a la criolla. 

Staff is...",2019-02-02 15:10:06
2308,SUGARFISH by sushi nozawa,VKOiEMaDnR41oA3Dw0mosg,5,"I'm mostly vegetarian but have fish from time to time as a treat. 
This was so worth it. 

As it was my first time I went with the Trust Me - perfect...",2019-03-24 14:15:30
2309,SUGARFISH by sushi nozawa,VKOiEMaDnR41oA3Dw0mosg,4,"Sugarfish was all of the sushi goodness I needed in my life last night. We landed in LA from Denver, our landlocked home, looking for some fresh sushi. For...",2019-03-08 08:15:35
2310,SUGARFISH by sushi nozawa,VKOiEMaDnR41oA3Dw0mosg,5,"First time here, and was pleasantly surprised. There was a little bit of a wait. 30-45 minutes, but well with it. They offered drinks from the bar while you...",2019-03-05 09:41:20
2311,Post & Beam,3dmkjDqnsp__V5kxsq6rOA,5,"Beautiful restaurant with delicious food in the heart of L.A.

The vegan crab cakes w/the kale salad on the side is abundantly flavorful. The kale salad has...",2019-04-09 09:21:21
2312,Post & Beam,3dmkjDqnsp__V5kxsq6rOA,4,Been hearing about this place for years and finally got the opportunity to stop in for brunch. I'm unsure if my expectations were so high based on previous...,2019-03-24 20:29:30
