,restaurant,restaurant_id,rating,text,time_created
696,Wax Paper,H6zhdp4uIC7a8Dq-ZBjH4Q,5,"Delicious sandwich shop located on a street corner in Frogtown. If you've never heard of Frogtown, you aren't the only one. I went to school in SoCal for 4...",2019-02-27 22:55:42
697,Wax Paper,H6zhdp4uIC7a8Dq-ZBjH4Q,4,"Went there yesterday for the first time and ordered the Ira Glass sandwich. It came with seeded wheat, avocado, cheddar, sprouts, pickled and raw red...",2019-03-21 13:38:02
698,Wax Paper,H6zhdp4uIC7a8Dq-ZBjH4Q,4,"It had been over a year since we went back to Wax Paper, but the warm weather this Saturday seemed to beg for a fresh sandwich.  We were not disappointed,...",2019-03-16 22:41:44
699,Small Town,0qP_mke-sPJELjdhYyBt4g,5,"5+ Rating

Chosen for a 31st anniversary celebration. A choice like this augers well for # 32!

Appreciated: Greeted on arrival by hostess and the manager /...",2019-03-20 17:06:24
700,Small Town,0qP_mke-sPJELjdhYyBt4g,5,"Visited Small Town for brunch on Saturday. Very cute, chill place with a beautiful outdoor patio. Food was so delicious. We got the eggs with toast and...",2019-03-10 00:01:34
701,Small Town,0qP_mke-sPJELjdhYyBt4g,5,"Had a great dinner here tonight. Well designed cozy and comfy place that felt like home, a nice home. Every dish was delicious and very presentable (see...",2019-03-23 22:29:26
702,Pho Saigon Pearl,CXmJB5LZeda27UeBGzk75Q,5,We had a birthday here for a friend and I don't think I have ever felt more accommodated by the staff and owner. They prepared for us a long long table and...,2019-04-06 21:05:18
703,Pho Saigon Pearl,CXmJB5LZeda27UeBGzk75Q,3,"Service is great, ambiance is lovely too! Slightly overpriced but that's par for the course.

But. The pho is... bad. The meats are delicious (I got a pho...",2019-02-24 19:48:10
704,Pho Saigon Pearl,CXmJB5LZeda27UeBGzk75Q,4,This place has amazing Pho! Very tasty and even the other things on the menu are really good. I've had all varieties of the fried rice and they are also...,2019-02-24 13:31:55
705,Mariscos Jalisco,5xFBQiB4Jcy9sI2fUHfcpg,5,I finally found the famous Mariscos Jalisco. After visiting my old school I decided to take the long way trip to Whittier through East LA and find the gem....,2019-04-01 14:44:10
706,Mariscos Jalisco,5xFBQiB4Jcy9sI2fUHfcpg,4,My go to spot for fish ceviche. Ceviche for two dollars can't be beat! I only ordered one as it's pretty filling. They also serve chips and salsa. They also...,2019-04-07 17:55:03
707,Mariscos Jalisco,5xFBQiB4Jcy9sI2fUHfcpg,5,OMG came here for a quick lunch to get the shrimp tacos and some shrimp cevichi.....Lord help me!! It was sooooo delicious!! Now i feel like i need this in...,2019-04-01 12:51:39
708,Hae Ha Heng Thai Bistro,BEItepse0gBSfkJ4sb_k-g,5,"Great Thai place I have ever had so far! 
#1 Great, delicious food! I love southeast flavor. We ordered Papaya salad, Tom yum Soup, Panang Curry, Pad See...",2019-04-04 15:49:13
709,Hae Ha Heng Thai Bistro,BEItepse0gBSfkJ4sb_k-g,4,"Small restaurant feel inside, chill relaxed hipster atmosphere outside. We chose to eat outside. 

Crab cream cheese wontons were perfect; crispy, not too...",2019-04-08 21:16:59
710,Hae Ha Heng Thai Bistro,BEItepse0gBSfkJ4sb_k-g,5,"My new favorite Thai restaurant! The vibes are so cute here, sort of like a hip mom and pops shop with a Volkswagen bus as decor inside the restaurant....",2019-04-02 15:20:09
711,HATCH Yakitori + Bar,eUkd8atkJe4fkKGcD5QZ1A,5,"My second time here and the food is as delicious as I remembered. This modernized yakitori bar offers unique menu items and numerous sake options. 
We sat...",2019-03-20 19:44:26
712,HATCH Yakitori + Bar,eUkd8atkJe4fkKGcD5QZ1A,4,I was a little hesitant because this place is fairly new and had mixed reviews but ended up here for a birthday dinner and was pleasantly surprised. It was...,2019-03-18 16:01:12
713,HATCH Yakitori + Bar,eUkd8atkJe4fkKGcD5QZ1A,4,A friend of mine was in town for work so we came here for their literal happy hour (5p-6p) for a drink and some small bites. I work in the Bloc and had been...,2019-03-18 13:33:28
714,Vernetti,TNkfaiMFw1e6dKWxTtGJHw,5,"So simple, yet so good! I came across this place on a Sunday when I was shopping at the farmer's market. The food looked amazing, so I had to make a...",2019-03-31 22:45:48
715,Vernetti,TNkfaiMFw1e6dKWxTtGJHw,2,"I am so disappointed. Vernetti is in my neighborhood. I can walk to it if I choose, and I had a long time friend visiting from San Francisco the evening. It...",2019-03-05 14:05:36
716,Vernetti,TNkfaiMFw1e6dKWxTtGJHw,5,"I'm surprised to see so many negative reviews! I used to live in Larchmont and Vernetti was always a go-to spot for brunch or dinner, and even now I still...",2019-02-19 10:50:46
717,Ruen Pair,UdpE_5k2c3zsGBFdcAjMGA,4,"Is a Ruen Pair is something to take to the shoe repair place or a Urologist? Nope. It's another spot to Thai one on.   

Once again, on my own odyssey...",2019-04-08 16:40:47
718,Ruen Pair,UdpE_5k2c3zsGBFdcAjMGA,5,"Fast service 
Great food 
Awesome 
I have been here twice and for sure this is one of the best Thai Food that I have tried so far!
I love their service and...",2019-04-02 19:10:37
719,Ruen Pair,UdpE_5k2c3zsGBFdcAjMGA,5,"This is my absolute favorite place to get Thai food in LA. Partly for nostalgia purposes, partly for how dang good the food is, partly because of the fact...",2019-03-25 19:36:35
720,Water Grill- Los Angeles,pDqUvoNY1kR963MJnfnL6Q,5,"I've had Water Grill bookmarked for quite a while, and I was finally able to try it for a late Valentine's Day dinner :) Water Grill is definitely a perfect...",2019-03-22 20:20:14
721,Water Grill- Los Angeles,pDqUvoNY1kR963MJnfnL6Q,4,"Came here on a whim to catch up with a friend.
 
The bread is fluffy and dense. Love!

I ordered the sea bass with gnocchi - light and melt in your mouth...",2019-04-05 17:17:56
722,Water Grill- Los Angeles,pDqUvoNY1kR963MJnfnL6Q,5,"I really liked the ambiance here. Our server was so on point. Drinks are brought to your table by anyone who is available. 

The server was so knowledgeable...",2019-03-17 14:41:16
723,El Chato Taco Truck,bvpxd7o3RZtz50YLpDsgLA,5,"OMG such good late night drunk food. 

We went to town. 10 carne asada tacos. 10 cabeza. 5 lengua. And a carne asada quesadilla. 

Seriously some of the...",2019-03-25 22:03:03
724,El Chato Taco Truck,bvpxd7o3RZtz50YLpDsgLA,5,"Been here so many times. It's just natural to review it. So from the rating and from the fact I have been here so many times, you know I am a happy...",2019-03-04 17:42:27
725,El Chato Taco Truck,bvpxd7o3RZtz50YLpDsgLA,5,One of the best taco truck in LA! I still have two other truck that I think is the best and this truck is definitely one of them. The difference about this...,2019-02-27 17:43:44
726,The Bento Place,DAw3V6KMp-Z4Wbr0dSObUg,5,This place is great! so much variety and food is made fresh everyday. They sell everything 50% off on the last hour so they can make sure to sell as much by...,2019-03-26 03:38:58
727,The Bento Place,DAw3V6KMp-Z4Wbr0dSObUg,3,"I ordered delivery for Tonkatsu and Salmon Avocado Roll. 

Salmon roll was really good but did not come with soy sauce??

The Tonkatsu was sooo dry it was...",2019-01-21 11:53:42
728,The Bento Place,DAw3V6KMp-Z4Wbr0dSObUg,4,"Gold Standard for Grab-and-Go Food

The Bento Place has everything I love about a restaurant. It focuses on a certain specialty (in this case, grab-and-go...",2018-12-30 02:03:21
729,HoHo Chicken,5swh0JcDk0VrNF6oA2_MfA,5,"They fry a damn good chicken. It's so CRISPY!!! 

My favorite part is how they package their to-go orders. They leave the box slightly open as to allow the...",2019-03-20 18:34:59
730,HoHo Chicken,5swh0JcDk0VrNF6oA2_MfA,5,"They have the cutest and crispiest chicken wings. 

My favorite flavors are original and lemon pepper. 

These wings are not very large and best for finger...",2019-01-12 13:03:43
731,HoHo Chicken,5swh0JcDk0VrNF6oA2_MfA,5,"Was craving Korean style fried chicken and saw that this place was close by. I have to say, it did not disappoint!

I ordered the soy garlic and sweet chili...",2019-01-03 13:02:13
732,Silverlake Ramen,jaLRtJ7YGYcCszfiBFxoHQ,5,"Wow 
Just wow 
With a side of wow 

Ok I'm not into the pork on top until I came here. They give you a nice  soft yet crispy piece of pork belly. Now I'm in...",2019-04-03 12:31:09
733,Silverlake Ramen,jaLRtJ7YGYcCszfiBFxoHQ,2,"I honestly don't know what the hype is about this ramen joint. It's just OK ramen. I had better, authentic ramen at other places with less wait. I order...",2019-04-03 17:08:22
734,Silverlake Ramen,jaLRtJ7YGYcCszfiBFxoHQ,4,"My dudes, both your broth and your pork slabs are super on point, of this I can't deny. But can you please at least tape over your beer list until you're...",2019-03-26 23:15:27
735,Kismet,jS8MhTJpHmGYuxcKonGG-A,5,"This place is my favorite everyday restaurant. Ideally I'd go at least once a week. I probably go once a month. Brunch is great, dinner is great. Everything...",2019-03-15 02:15:43
736,Kismet,jS8MhTJpHmGYuxcKonGG-A,1,"I got food poisoning there TWICE now, so starting to rethink it. Once is random bad luck, but twice is... when perhaps one should stop making the same...",2019-03-30 17:41:02
737,Kismet,jS8MhTJpHmGYuxcKonGG-A,4,This is my second time dining here. Yelper Isobel L. and I arrived 10 minutes early for our dinner reservation. We hung out by the bar area. She got a Rose...,2019-03-14 09:04:06
738,Palms Thai Restaurant,7qZBxWisbeVI34gIeNpP1A,5,"The food at this restaurant is so good. We originally ordered for delivery via Doordash the other night. Unfortunately, that was a nightmare, and completely...",2019-03-30 13:00:09
739,Palms Thai Restaurant,7qZBxWisbeVI34gIeNpP1A,5,"Very delicious food
Excellent service
Generous amount of food for the price

What I ordered:
- Spicy Beef Noodle: very tasty, lots of flavor, and lots...",2019-03-24 18:41:38
740,Palms Thai Restaurant,7qZBxWisbeVI34gIeNpP1A,4,"Came here on a Saturday afternoon and it wasn't too busy.  This is a large place so seating is pretty quick, especially since all the staff are equipped...",2019-03-18 14:43:47
741,Rustic Kitchen Market & Cafe,AgUSfMByb7r4ffVR2WYMuw,5,"The Rustic Kitchen has everything that one could ask for in a local spot:

1) great food - fresh and made to order
2) excellent service
3) solid ambiance
4)...",2018-12-31 17:52:50
742,Rustic Kitchen Market & Cafe,AgUSfMByb7r4ffVR2WYMuw,2,Lunch service was fast but we received no follow up attention after food was delivered. Unable to get the attention of the server with my polite attempts at...,2019-02-27 14:02:41
743,Rustic Kitchen Market & Cafe,AgUSfMByb7r4ffVR2WYMuw,5,Really great restaurant in Mar Vista.  Love their Tomato Soup. The Connecticut  Lobster Roll was great.  They have a really great breakfast.  Everything...,2018-12-26 19:23:06
744,Stevie's Creole Cafe,EKrVpJqTXBjbbJPgHusibQ,5,"In past reviews I alluded to the power of love to elevate a dining experience. Irrespective of cost, a meal made with love is special.

Stevie's gumbo was...",2019-03-27 11:19:04
745,Stevie's Creole Cafe,EKrVpJqTXBjbbJPgHusibQ,4,"I went here yesterday and ordered the BBQ chicken dinner with double mac and cheese, with a side of cornbread. 

The chicken was good, but my only problem,...",2019-03-25 10:52:59
746,Stevie's Creole Cafe,EKrVpJqTXBjbbJPgHusibQ,1,"I don't leave reviews often, and the service was very nice. The people who work there are really sweet so this isn't meant to be malicious just factual....",2019-03-23 10:17:51
747,Golden State,DryPvekrxsqbpOJNOajRpA,5,Top 5 burgers I've tried in Los Angeles! Solid option if you're in the mood for a burger and decent selection of beers on tap. I found street meter parking...,2019-04-03 12:06:26
748,Golden State,DryPvekrxsqbpOJNOajRpA,5,I've been meaning to try this place for awhile.   So glad I finally got here.  The burger was excellent.   The sweet potato fries were good.   The cucumber...,2019-02-10 20:03:17
749,Golden State,DryPvekrxsqbpOJNOajRpA,5,"Bomb burgers! Cooked perfectly. Med rare just like I asked. Lil pricey but all in all worth it ! 

Heads up:  Parking sucks because it's off of a main...",2019-01-17 15:35:39
750,Myung In Dumplings,jCDnwiF2JN5OBbzwlrWuhA,5,"There is a reason Anthony Bourdain recommenced this place....
It's tucked away in a cool little strip mall in Koreatown.
The customer service is awesome and...",2019-03-01 13:11:53
751,Myung In Dumplings,jCDnwiF2JN5OBbzwlrWuhA,3,"I was expecting this place to be great after reading the reviews and seeing Anthony Bourdain's picture up on the wall...

I gave them 3 stars because I am...",2019-04-07 00:50:42
752,Myung In Dumplings,jCDnwiF2JN5OBbzwlrWuhA,5,"A bit of a hole in the wall... but it's delicious!

I've only tried their dumplings and steam buns, they're all hits. Also, not many filling options, mainly...",2019-02-18 12:07:35
753,n/naka,tDeuHjIUJrHeELrKEekXtA,5,"Chef Nakayama has done it again! 

This was my second time dining at n/naka and the restaurant as a whole did not disappoint. The reason why I say this is...",2019-04-02 09:42:01
754,n/naka,tDeuHjIUJrHeELrKEekXtA,5,"Amazing amazing amazing! I have been waiting to visit n/naka even before it came on chefs table. The meal was nothing short of exceptional. The staff,...",2019-03-30 20:44:45
755,n/naka,tDeuHjIUJrHeELrKEekXtA,4,N/Naka is a small discreet restaurant in a nondescript part of town.  I chose this restaurant for my birthday because I've been dining in a lot of Michelin...,2019-03-29 08:31:57
756,Wirtshaus German Restaurant & Beer Garden,-3S1PdyDbSQcqkIaX8VKrQ,5,I brought a party of 30 here representing the UCLA German club and we all had a great time. There are plenty of board games to play with your friends and...,2019-02-11 22:39:54
757,Wirtshaus German Restaurant & Beer Garden,-3S1PdyDbSQcqkIaX8VKrQ,4,"Enjoyed an early Sunday dinner on the patio after a matinee at the Pantages. Schnitzel, pretzel, and steins of beer are staples! Sausages and sauerkraut are...",2019-04-08 00:33:27
758,Wirtshaus German Restaurant & Beer Garden,-3S1PdyDbSQcqkIaX8VKrQ,4,"Great German food! The chicken schnitzel I had was cooked perfectly, and served nice and hot! 

The apple strudel is good but nowhere near as good as the...",2019-04-01 19:05:47
759,Son of a Gun,rJDsg0rZfuT0tsXbDaxRgA,5,"Son of a Gun

This place is LOVE FOR LIFE!

I've visited multiple times with my boyfriend and we loved it so much! I was so happy when my best friend told...",2019-03-28 21:57:54
760,Son of a Gun,rJDsg0rZfuT0tsXbDaxRgA,5,Changed up the regular lunch and decided to branch out a bit! We had been talking about eating here for years and happy we did. We had a lunch reservation...,2019-03-24 17:12:01
761,Son of a Gun,rJDsg0rZfuT0tsXbDaxRgA,3,Haughty mediocre food at a high price.  Fried chicken sandwich is fine but overpriced and undersized.   The lobster roll portion size ridiculously small....,2019-02-23 16:18:42
762,Daw Yee Myanmar Corner,XFWlU7sXDL3SIy7rmUVQpA,5,"I've never had Burmese food until I visited this interesting nook. The food is very unique, something to get used to I suppose. But for my first experience,...",2019-03-05 13:02:41
763,Daw Yee Myanmar Corner,XFWlU7sXDL3SIy7rmUVQpA,2,"I came here because of the good reviews but I was really disappointed. 

The Tea Leaf Salad was honestly just bad. I LOVE tea leaf salad - after living in...",2019-03-09 09:33:19
764,Daw Yee Myanmar Corner,XFWlU7sXDL3SIy7rmUVQpA,3,"I visited Myanmar a few months ago and loved the food. So I was very excited to try this place. Sadly it was just ok. 

The tea leaf salad was not good. The...",2019-03-04 19:44:20
765,Izakaya Fu-ga,OowWjnNFs-Lfw0Kfx8GmJw,4,"I came with a part of 4 on a Saturday night at 7PM, where the venue was probably half full - it did end up being quite packed as the night went on, so I'd...",2019-03-20 08:11:56
766,Izakaya Fu-ga,OowWjnNFs-Lfw0Kfx8GmJw,5,"Came here out of the blue on a Monday afternoon in time for their lunch special. This place is hidden downstairs and once you walk in, your surprised by the...",2019-02-27 13:53:21
767,Izakaya Fu-ga,OowWjnNFs-Lfw0Kfx8GmJw,5,"We loved the variety of food offerings as well as the sake selections 

Great underground ambiance with exceptional service every time we've been here",2019-02-16 23:06:12
768,LASA,u9sTaFMUwRTsRBozTzNZog,5,Had the honor of finally trying this cute spot! Enter a quaint spot full of character and ambiance- made you feel like you were in a cool hip spot in the...,2019-03-30 11:35:48
769,LASA,u9sTaFMUwRTsRBozTzNZog,5,"Tried LASA last night and it was incredible. It was refreshing and welcome taste of the Filipino food I grew up on. We had the Pompano Fried Fish, Beef...",2019-03-14 18:38:13
770,LASA,u9sTaFMUwRTsRBozTzNZog,4,"Amazing presentation, creative, and delicious. Of everything we ordered, the mushroom adobo tartine was my absolute favorite (I honestly wish I knew how...",2019-03-05 19:38:49
771,Stuff'd Dumpling Shop,s_7GKYJX19rJrmxp2EBA-Q,5,"My gf brought me to this place.  The dumplings were excellent.  I did have to eat 21 of them but they are dumplings, so it is expected.

The service was...",2019-04-08 19:15:10
772,Stuff'd Dumpling Shop,s_7GKYJX19rJrmxp2EBA-Q,3,"I had seen this place on social media and wanted to give it a try. 
If you're into the ""i don't care if the food is good. I'll just go just to look cool...",2019-04-05 23:45:06
773,Stuff'd Dumpling Shop,s_7GKYJX19rJrmxp2EBA-Q,5,"I ate lunch here and absolutely loved it!
The dumplings were tender and flavorful,and most importantly not mushy or soggy.
I had 3 bowls of the vegan...",2019-04-05 19:07:43
774,Honey Bee's House of Breakfast,UJg9U_6djc7Wc089s1hFCg,5,"The place is cute. The food really good. The service sucks! My daughter and I were the only people in the restaurant and were ignore. I had to get up, find...",2019-03-29 09:21:36
775,Honey Bee's House of Breakfast,UJg9U_6djc7Wc089s1hFCg,5,"Skip the regular pancake joints and go here!! 

Hands down THE  fluffiest moistest pancakes I've had EVER!! And the hash browns were the right amount of...",2019-02-11 13:41:31
776,Honey Bee's House of Breakfast,UJg9U_6djc7Wc089s1hFCg,5,"My favorite local breakfast restaurant by miles! 
I am addicted to this casual, delicious restaurant. 
I almost always order the el clásico, which is a...",2019-02-08 21:22:40
777,Beer Belly,EZYxkHi9nhI2Hg5KDdxyLw,4,"Okay, so I get grumpy when I've gotta wait to get my drink on after a punishing day. This isn't the first time I've bumped a beer bar down to one star in a...",2019-04-03 20:23:50
778,Beer Belly,EZYxkHi9nhI2Hg5KDdxyLw,2,My friend and I are visiting from Phoenix and this location was recommended. I was extremely let down when the hospitality was less then friendly. I asked...,2019-03-30 17:21:46
779,Beer Belly,EZYxkHi9nhI2Hg5KDdxyLw,5,"Had been eyeballing this spot for a while and then a friend hosted a Crowns & Hops event so I was finally able to try it. 

The owner is incredible. Great...",2019-03-25 17:43:38
780,The Ivy,gxrQw6uNbO7AYMykhePHAQ,4,"My husband and I were on a 2 days trip to LA and looking for great food in LA. I am so glad that we decided to eat at The Ivy.

The ambiance, location, and...",2019-03-25 16:26:41
781,The Ivy,gxrQw6uNbO7AYMykhePHAQ,3,A friend recommended this place and I was looking forward to it because it looked beautiful inside. The decor didn't disappoint with fresh flowers...,2019-03-22 17:44:14
782,The Ivy,gxrQw6uNbO7AYMykhePHAQ,5,"Ivy oh how I love thee!  Absolutely everything about this place is wonderful. I've been a few times and love it through and through. It is expensive, but...",2019-03-21 14:46:17
783,Ktown Pho,HvDYCHDpgBy3CmzRD6gcMg,5,"For someone that's Vietnamese and knows exactly what good authentic pho tastes like, this is your damn spot in LA! I can't believe it!!! 

I went here last...",2019-04-03 15:40:19
784,Ktown Pho,HvDYCHDpgBy3CmzRD6gcMg,5,"My Pho game up until early 2017 lacked profusely due to one bad experience and a few 'I already know this isn't going to be good' outings to follow.

Ktown...",2019-03-30 19:07:12
785,Ktown Pho,HvDYCHDpgBy3CmzRD6gcMg,5,"It's been awhile since I came here and it never disappoints me! 

The BunBoHue Oxtail here is the best one in LA, I haven't tried one that meets the level...",2019-03-29 20:54:31
786,Tsuri,ciZAxEwbFBafvf2UGUxySw,5,"THIS PLACE IS A GEM!!! YOU'RE WELCOME.
I don't even want to tell people about this because it's so good that I want it to stay hidden.
The fish is...",2019-03-15 19:48:22
787,Tsuri,ciZAxEwbFBafvf2UGUxySw,3,Went to this restaurant for a late lunch and no one was there which seemed a little off because it's on Melrose Ave. but anyway I ordered the lunch special...,2019-04-05 09:22:56
788,Tsuri,ciZAxEwbFBafvf2UGUxySw,1,"Saturday night, we are on time for our reservation. We walk in to no hostess. We wait. A woman walks in behind us and the host comes over and seats her....",2019-03-03 20:46:49
789,Next Door Lounge,Dv6-iy7-tN8ETAjqW6eg4g,5,Celebrated my Birthday here this past Saturday 3.16.19 and it was such a fun night... David was so easy to get in touched with and my reservation was ready...,2019-03-18 20:50:21
790,Next Door Lounge,Dv6-iy7-tN8ETAjqW6eg4g,5,"We planned a bday and anniversary party on a Saturday night and had an amazing time! We are so glad we celebrated there, it truly is a hidden gem. David was...",2019-02-25 12:32:00
791,Next Door Lounge,Dv6-iy7-tN8ETAjqW6eg4g,2,"PROS
The drinks were very tasty, and there were plenty of unique cocktails to choose from. The DJ was also great.

CONS
The food! What is this menu?! It is...",2019-02-10 01:06:18
792,Poppy + Rose,NlT-6hFP0_6hPo36AW2lIA,5,The chicken here melted in my mouth. It was perfectly cooked and so flavorful. Next time I come back I gotta try the salad ! The iced latte was very good as...,2019-04-08 07:46:56
793,Poppy + Rose,NlT-6hFP0_6hPo36AW2lIA,4,"Rating reflects a somewhat inconsistent menu for a place I really wanted to love. First off, the staff are golden. Very attentive, nice and exceptionally...",2019-04-07 15:23:18
794,Poppy + Rose,NlT-6hFP0_6hPo36AW2lIA,3,"Location? Excellent, right next to the Flower District, as other Yelpers mentioned.

Wait? Absolutely! Don't come when you're hangry.

Came here on a...",2019-04-04 21:22:51
795,Versailles Cuban Food,ssAlyvM97hroBeVPVJPgwA,4,Versailles in Venice Blvd is the best Cuban culinary treat in LA!  I've eaten at this location for years.  It gets crowded for dinner and parking is limited...,2019-03-19 17:30:18
796,Versailles Cuban Food,ssAlyvM97hroBeVPVJPgwA,1,I walk in to the restaurant the right away I felt like i was in a department store everyone was jumping to help me like if they get commission for getting...,2019-04-04 19:36:13
797,Versailles Cuban Food,ssAlyvM97hroBeVPVJPgwA,4,"Some things just doesn't change. The flavor of the garlic and lemon chicken. The black beans and rice, is so good. The ""mojo"" sauce is SOLit. 

This dish...",2019-02-26 07:43:30
798,Olympic Noodle,Qo4F-RObp5GXE_-vZXzD5g,5,"A hidden Korean gem.

Humongous portions and delicious food. My boyfriend and I came here with cravings for Korean cuisine and this place was nearby so we...",2019-01-26 13:58:53
799,Olympic Noodle,Qo4F-RObp5GXE_-vZXzD5g,4,"There are times when I miss my mom's cooking and when I can't go home for some Korean comfort food, I come to Olympic noodle, especially on a cold/rainy...",2019-03-27 17:05:06
800,Olympic Noodle,Qo4F-RObp5GXE_-vZXzD5g,5,Olympic noodle is where I first started to love Korean food. It just has the feeling of walking into your grandmas house and the food taste the same. It's...,2019-01-23 20:09:29
801,The Kickin’ Crab,khApvUwH1Xhe3MtaXmaZsg,5,"ABSOLUTE PERFECTION! My trusty sidekick, Yelp, guided me to The Kickin' Crab and I couldn't have had a better experience. From the moment you walk in and...",2019-04-07 17:28:43
802,The Kickin’ Crab,khApvUwH1Xhe3MtaXmaZsg,5,Great new spot. Free easy strip mall style parking directly in front. No wait. Great food similar to the boiling crab or juicy crawfish. Pretty much the...,2019-04-04 22:27:14
803,The Kickin’ Crab,khApvUwH1Xhe3MtaXmaZsg,5,So glad to have a place like this so close to where I live. Garlic noodles are a amazing and I really feel like you get your moneys worth with the bah of...,2019-03-29 16:08:50
804,Aroma Cafe,AmtMwS2wCbr3l-_S0d9AoQ,5,"my go to is the lamb kebab with grilled vegetables and, if our table wants a starter, the grilled potatos

the grilled vegetables are lemon-and-olive oil...",2018-12-18 15:09:55
805,Aroma Cafe,AmtMwS2wCbr3l-_S0d9AoQ,4,"An amazing place with true and authentic Balkan food options. Very professional staff and great atmosphere every time we went there. 
Highly recommended!...",2019-01-24 16:04:40
806,Aroma Cafe,AmtMwS2wCbr3l-_S0d9AoQ,2,"Food was great. Service was wonderful. 
The one thing that will make me think twice if I should get back there is lack of changing station. 
I was there...",2018-11-29 23:56:04
807,Blue Cow Kitchen & Bar,81kXeyBt1AKiJC_HITT9KA,4,Really cool place to grab a bite at during lunch hour or dinner-Plus its a bit separated from the other restaurant area down the street which is really...,2019-03-04 11:16:15
808,Blue Cow Kitchen & Bar,81kXeyBt1AKiJC_HITT9KA,3,"The food was excellent!! 
We were a party of 4,  everyone was really happy with what they got. The reason I give a 3 is because  service was not so good....",2019-02-22 20:23:44
809,Blue Cow Kitchen & Bar,81kXeyBt1AKiJC_HITT9KA,4,"An easy walk to/from the Broad, Disney Hall, MOCA, etc, we had a nice dinner here before a show.  TV's tuned to sporting events, but they are unobtrusive if...",2019-02-20 08:54:31
810,Shabuya,tGusz6xqBBABc1awGP1aLA,5,"Food Quality: 9.5/10
Meat Quality: 9.5/10
Sauce Options: 10/10
Restaurant cleanliness: 8/10
Serving: 5.5/10
Valet options/parking: 9/10 (super cheap...",2019-03-07 15:21:10
