,restaurant,restaurant_id,rating,text,time_created
1390,25 Degrees,rLKI1EzuwGUFixHtqXqZ9g,5,My son and I took an LA road trip during his Spring Break and decided to do some of the touristy things we never do like Madame Tussad's.  I did a small...,2019-03-31 07:30:32
1391,25 Degrees,rLKI1EzuwGUFixHtqXqZ9g,1,Service here on my last few visits has been non-existent. Where are the guys who are in these photos that customers seem to like? Obviously they've been off...,2019-03-27 00:20:36
1392,25 Degrees,rLKI1EzuwGUFixHtqXqZ9g,4,"I was a guest staying at the Hollywood Roosevelt and decided to stop in and have lunch here.

I had a nice experience. It was a Sunday afternoon, they had...",2019-03-25 17:45:08
1393,Oaxacan Quesadilla Cart,RMi8jn4ZBnAL3-l1T7tjmA,5,"Echo Park's lil secret.. which really isn't a secret anymore hahah. Succulent, plate-sized blue corn quesadillas for only $4 (or $6 if you get both...",2018-11-03 11:57:29
1394,Oaxacan Quesadilla Cart,RMi8jn4ZBnAL3-l1T7tjmA,5,"This is one of the reasons I love LA. Where else are you gonna get Oaxacan blue corn quesadillas handmade right in front of you at a cart? And yes, every...",2018-05-21 13:45:18
1395,Oaxacan Quesadilla Cart,RMi8jn4ZBnAL3-l1T7tjmA,5,Tiny little food cart next to a public parking lot!? Fresh hand-pressed blue corn tortillas. Crunchy chicharon quesadilla -  topped with the spicy green...,2019-01-12 17:45:13
1396,Dulan's On Crenshaw,4ZmXcttDdx9KRGUi6tMWFQ,5,"I've been to dueling about 30 times in the last 10 month. The customer service is consistently amazing.
 I'm always greeted with a smile and the experience...",2019-02-14 19:17:56
1397,Dulan's On Crenshaw,4ZmXcttDdx9KRGUi6tMWFQ,4,I made my way to Dulan's on a Friday night to see what the hype was all about. It is a small cafeteria style establishment with plenty of seating indoors...,2019-04-06 11:33:40
1398,Dulan's On Crenshaw,4ZmXcttDdx9KRGUi6tMWFQ,2,"Skip this place! Not worth it! I had the smothered chicken, mashed potatoes, and Mac n cheese. I'll break down the disappointment:

Chicken: soft, but...",2019-03-25 14:48:54
1399,FryMadness,LcRB5s8-VDCSmpxWK0lwfw,5,"I was really excited to try this place because my lady friend loves, I mean loses her mind over French fries. The place looks nice, very quite and well...",2019-03-26 18:33:35
1400,FryMadness,LcRB5s8-VDCSmpxWK0lwfw,4,"Okay, finally got to eat here after only getting takeout once. Over two visits, colleagues and I had the following...

El Elotero Fries - Really good flavor...",2019-03-22 16:19:46
1401,FryMadness,LcRB5s8-VDCSmpxWK0lwfw,4,"I love French fries.

With that being said, I went into my sole FryMadness experience less than enthused. Something about places that focus on French fries...",2019-03-21 12:47:51
1402,The Dragon and Meeple,dxLiwx8Ghcm0AWNph0xrVw,5,The Dragon and Meeple is a great place to spend an evening playing tabletop games. I've been here twice now and have thoroughly enjoyed myself each...,2019-04-07 09:14:44
1403,The Dragon and Meeple,dxLiwx8Ghcm0AWNph0xrVw,5,"PREFACE: This is a new business and they have not yet received their liquor license, but it is happening. 

In the meantime, they have really great food and...",2019-03-15 20:48:21
1404,The Dragon and Meeple,dxLiwx8Ghcm0AWNph0xrVw,5,My friends and I just stumbled on this place by chance and we're already in love with it! The food is amazing (please try the Korean BBQ pulled pork grilled...,2019-04-07 19:30:12
1405,Blacksmiths,OwoEStx-D5Dy5cGedkXrdQ,5,"Beautiful restaurant. I love the ambience. Staff was wonderful and friendly. Even the manager asked how we were doing.
I had the mushroom ravioli and...",2019-03-14 19:22:08
1406,Blacksmiths,OwoEStx-D5Dy5cGedkXrdQ,3,"Cons: 
1. smelled like sewer water on the patio and entrance area. 
2. Black Cat & Red Mac is insanely salty. The chef needs to lay off the salt. I couldn't...",2019-03-24 11:08:40
1407,Blacksmiths,OwoEStx-D5Dy5cGedkXrdQ,4,Gal pal and I had a joint birthday dinner here with a total of 8 of us. We hung out at the bar while we waited for the rest of our party where I discovered...,2019-03-22 12:56:01
1408,The Semi-Tropic,h3KzTYozazMtdhS8C1qBXg,5,"This place is perfect for your Sunday Funday vibes in Echo Park. This place had all the vibes, yet we didn't have to wait in line for an hour before we got...",2019-04-05 07:30:33
1409,The Semi-Tropic,h3KzTYozazMtdhS8C1qBXg,5,"I like...straight up fucks with this place.  They don't shortchange you on the food, I can usually find parking and I love the different types of chill...",2019-04-02 01:12:45
1410,The Semi-Tropic,h3KzTYozazMtdhS8C1qBXg,5,Visited on a Wednesday night and was so pleasantly surprised. It was a nice level of crowded - aka not so crowded it's hard to find a seat but not so empty...,2019-03-28 15:19:28
1411,The Carving Board,xvkQxQ8WoNoHwHw5rqxLuA,5,"Excellent sandwiches. Great branding. The mixed fries side is awesome.

I always get it togo, and they always wait till I get there to fire the fries, so...",2019-03-09 17:00:15
1412,The Carving Board,xvkQxQ8WoNoHwHw5rqxLuA,4,"We really enjoyed the French dip sandwiches here.  Good solid sandwich, with a very tasty au jus.  The salads are made with an exquisite mix of lettuces and...",2019-03-17 12:53:23
1413,The Carving Board,xvkQxQ8WoNoHwHw5rqxLuA,5,First time here and I am very impressed. The employee who took my order was very helpful. He made a few suggestions which I went with... I ended up...,2019-02-03 17:38:21
1414,LA Paella,hqR-2X38R1Xl-8Jh_G3WNQ,5,"We LOVE this place! 

We've only been here once but the food was amazing!

We ordered the Paella Marinera, Salpicón De Mariscos (ceviche style) and a 1/2...",2019-03-25 15:19:15
1415,LA Paella,hqR-2X38R1Xl-8Jh_G3WNQ,3,"This was our 8th Valentines Day dinner here and will definitely be our last. This place isn't horrible, but there is definitely a lot of nostalgia that...",2019-02-14 21:07:33
1416,LA Paella,hqR-2X38R1Xl-8Jh_G3WNQ,5,"Welcome to heaven, my fellow seafood lovers! The name of the restaurant says it all - best paellas in town but let's talk tapas first. They have a huge...",2018-11-18 10:01:44
1417,Father's Office,wBeNozAR6wlJLTEwdWdPQg,4,"This is less a review of Father's Office and more a review of their burger and fries. The staff were nice, the place was clean, and our meal was ready...",2019-04-04 07:22:30
1418,Father's Office,wBeNozAR6wlJLTEwdWdPQg,1,"The ambience on a Saturday night was inviting, but the only reason we'd chosen this place over significantly higher rated restaurants in the area was that...",2019-04-09 10:23:06
1419,Father's Office,wBeNozAR6wlJLTEwdWdPQg,4,"Definitely a GASTROPUB - food menu dwarfed by huge adult beverage selection and very high quality ingredients (ie. crab, scallops, osso bucco)

**Bring your...",2019-03-20 15:55:38
1420,Elf Café,hafmNRWqoLKQ10dMVDh-yQ,5,"Starting with the Elf salad, amazing!, the combination of
All different interesting and delicious flavors.
Also recommend The babaganoush probably the best...",2019-03-30 20:11:43
1421,Elf Café,hafmNRWqoLKQ10dMVDh-yQ,2,Historically I have loved this restaurant but the last meal I ate there was disappointing on a variety of levels. Here are the central points of my...,2019-03-17 19:37:13
1422,Elf Café,hafmNRWqoLKQ10dMVDh-yQ,5,"A hidden classy upscale cozy gem . 
Make reservation in advance!! 
Perfect date spot ! 

Delicious Vegan food ( only couple couldn't have vegan option )  
A...",2019-03-15 23:57:11
1423,Ostrich Farm,nUT0BaARIUa1I_qV39mj9A,5,"Ostrich Farm came highly recommended by a friend, so I made a reservation weeks in advance. It was super simple and I also received a follow-up confirmation...",2019-02-17 18:36:02
1424,Ostrich Farm,nUT0BaARIUa1I_qV39mj9A,4,Made reservations for 12:15 Sunday brunch for 4. Had a little bit of an unlucky situation in that the party sitting at our table wouldn't leave! The manager...,2019-04-08 19:54:36
1425,Ostrich Farm,nUT0BaARIUa1I_qV39mj9A,3,"The restaurant was very cute and the food was good but not amazing.

My boyfriend and I were looking for a quick bite in the neighborhood and this place...",2019-03-29 14:48:47
1426,un solo sol,mBD3hhlyqc2A301Y1CVwUg,5,"The food here is absolutely amazing. I have never sat down to eat at the location, however whenever I walk in to pick up my to go order the place seems...",2019-02-28 11:45:50
1427,un solo sol,mBD3hhlyqc2A301Y1CVwUg,4,"Went here for lunch with my coworkers. It is located in East LA. Parking is all street, but it wasn't too hard to find for lunch hour. There are some...",2019-03-01 16:18:25
1428,un solo sol,mBD3hhlyqc2A301Y1CVwUg,5,"I stopped by here yesterday before a gig and was taken by the charming decor and fresh fruits displayed.  I was helped immediately by a nice server, who...",2019-02-22 08:20:52
1429,Duidough Cafe & Cookie Lab,E68xieHpN3TgXjTaV84Urg,5,Old town charm and service in a 21st Century motif.   I had a couple of programs I was running at the nearby library and resolved to grab a bite to eat...,2019-04-05 13:55:22
1430,Duidough Cafe & Cookie Lab,E68xieHpN3TgXjTaV84Urg,4,"They really cater to a variety of dietary options here. Definitely something for everyone, whether you're vegan, paleo, Keto, etc. 

I know that they are...",2019-03-18 20:10:43
1431,Duidough Cafe & Cookie Lab,E68xieHpN3TgXjTaV84Urg,5,"Life Changing French Toast! 

The food is amazing... I had the French toast with berry compote and it was so delicious!  The owner David is so nice and you...",2019-03-13 15:30:23
1432,The Park,IygcFrP7yIComDXZKxDasg,5,"Probably my favorite restaurant in LA. Great food and waitstaff in an unpretentious, comfortable space in the heart of Echo Park.
A little hard to see from...",2019-03-05 11:59:02
1433,The Park,IygcFrP7yIComDXZKxDasg,4,"Classic Sunday brunch. 

We got here a little after noon and were quickly seated. The dining room was more than half full and had a good mix of people....",2018-12-04 11:37:04
1434,The Park,IygcFrP7yIComDXZKxDasg,1,"The coffee was good. Food was incredibly underwhelming. Not worth the price. The French toast was just bread with powdered sugar on it and syrup, no fruit?...",2019-04-08 08:16:20
1435,Cactus Taqueria #1,F-rQ33zVrlNIPBFPoXZOSQ,4,This is usually my stop every once in a while for a breakfast burrito. It taste great and is pretty stuffed. The burritos aren't just filled up with lots of...,2019-02-07 11:51:08
1436,Cactus Taqueria #1,F-rQ33zVrlNIPBFPoXZOSQ,2,"(Dined 03/26/19 TU @ 10:00pm): I liked cactus but didn't seen any on the menu!

A friend and I came across Cactus Taqueria #1 as we walked towards my car...",2019-03-31 22:51:07
1437,Cactus Taqueria #1,F-rQ33zVrlNIPBFPoXZOSQ,1,Omg I love this place and their food!!!! It's abso-fuckin-lutely amazing when Luis (bald headed cook)is not the cook. My favorite item on the menu is the...,2019-03-31 22:26:18
1438,Pann's Restaurant,PFi2KCQzPNqWMdw8HXcdAA,5,"Still probably my favorite diner in LA. The place used to be opened later hours, but from what I heard, they cut back because of the new minimum...",2019-04-06 14:45:41
1439,Pann's Restaurant,PFi2KCQzPNqWMdw8HXcdAA,4,"Wonderful service and great friend chicken. This placed hadn't changed in forever And it never should

Service was top notch",2019-03-31 15:59:21
1440,Pann's Restaurant,PFi2KCQzPNqWMdw8HXcdAA,5,I was driving on my way home from Malibu and was really hungry so I thought I'd drop by here and grab a bite to eat. I love the Googie/Space Age...,2019-02-09 23:00:25
1441,The NoMad Restaurant,77OCLqNangVVY-GHXAE7ng,4,I came on a Sunday for brunch with a friend and was seated quickly. The place has really nice decor and a lot of people pop in just to take photos. I...,2019-04-04 12:10:45
1442,The NoMad Restaurant,77OCLqNangVVY-GHXAE7ng,3,"Conflicted on the 3 star rating, but after everything I'm okay with it.

First of all, the drinks were INCREDIBLE. 5 star drinks, 5 star spirits, 5 star...",2019-03-30 16:20:03
1443,The NoMad Restaurant,77OCLqNangVVY-GHXAE7ng,5,One of the highlights of the downtown LA restaurant scene. Nomad has a fantastic ambience of old hotel charm. The restaurant is truly an experience of sight...,2019-03-19 21:22:50
1444,Nocturnal Eats,LwOGo0Hnq9PErejOvOP0HQ,5,"Honestly it was great. The dracarys burrito and waffle fries were a perfect comfort food for a late night dinner. I added queso, sriracha ranch, chili...",2019-04-08 00:03:27
1445,Nocturnal Eats,LwOGo0Hnq9PErejOvOP0HQ,5,"Normally I'm skeptical about ordering take out, especially when it's late. The food normally arrives barely warm or even cold BUT this place is AMAZING! I...",2019-04-05 23:57:06
1446,Nocturnal Eats,LwOGo0Hnq9PErejOvOP0HQ,5,Can't believe I get to write the first yelp review for this amazing place! I ordered a delicious quesadilla at around midnight and it was delivered in a...,2019-03-22 00:30:17
1447,Mendocino Farms,cEGNvEu0QtRLs7uVqY0dag,5,The wife and I were in the area checking out the shopping center and decided to look at the Mendocino Farms menu. We noticed a devoted vegan section on...,2019-03-11 15:34:14
1448,Mendocino Farms,cEGNvEu0QtRLs7uVqY0dag,4,"What I Ordered
- Mendo's Chicken Cobb Salad

Can't go wrong with a salad for dinner sometimes. The Mendo's Chicken Cobb Salad was good..after I picked out...",2019-04-04 18:58:52
1449,Mendocino Farms,cEGNvEu0QtRLs7uVqY0dag,3,"Now I know most places will site that Mendocino is so fresh and uses amazing ingredients! That is why you should pay $10-$12 for a sandwich! Well, I am here...",2019-03-18 22:13:36
1450,California Chicken Cafe,W8RQPUOgLC7d_kO0h3B_QA,5,I really like this place- I always order the Chicken Caesar wrap and mix my lemonade with the cherry syrup over shaved ice for a ridiculously diabetic...,2019-03-27 18:39:43
1451,California Chicken Cafe,W8RQPUOgLC7d_kO0h3B_QA,4,First time ordering from here and Overall it was a good experience! We ordered two salads the Caesar and the 411! Both salads are so good I had to stop and...,2019-02-15 21:37:11
1452,California Chicken Cafe,W8RQPUOgLC7d_kO0h3B_QA,3,I went to wash my hands while they redid my salad (they had messed it up which was no big deal) using the same sink that the employees do. OMG it is sooooo...,2019-02-09 16:21:56
1453,Trejos Tacos - La Brea,rf20-kFTkk9BC4tfr8K_3g,5,"Trejos probably doesn't need my review, but here's my two cents. 

I'm pescetarian so I love finding really good vegan/vegetarian taco options. There are a...",2019-03-25 20:38:46
1454,Trejos Tacos - La Brea,rf20-kFTkk9BC4tfr8K_3g,3,"Breakfast is good but I wasn't a fan of lunch. 

I HAD A FRIED CHICKEN BOWL & THOUGHT THE  CHICKEN/FRY was cooked too long. They gave me another taco which...",2019-04-04 14:21:11
1455,Trejos Tacos - La Brea,rf20-kFTkk9BC4tfr8K_3g,3,"I wanted to love this place. I saw the Bourdain special on Danny Trejo as a restaurateur, it looked inventive and tasty (the other location), and Danny...",2019-03-27 23:04:25
1456,Thank U Pho,bntaaduchQQiBI7Dt12Pgw,5,"Their veggie pho is my favorite, steak one is good too. 

Tried their spring rolls once not a fan.",2018-12-30 18:18:01
1457,Thank U Pho,bntaaduchQQiBI7Dt12Pgw,1,"Can you even call it pho? it's watered down and tastes like nothing. the noodles were clumped together straight out of the kitchen. (see photo)
Worst pho i...",2019-03-03 21:08:41
1458,Thank U Pho,bntaaduchQQiBI7Dt12Pgw,4,"We came by accident. 
FYI This review is by two tourists from NYC 

We got 
1. Seafood Pho - 3.5/5 
A tad bit scarce in toppings, it had 3 shrimp, 5 half...",2019-02-04 21:30:31
1459,Totoyama Sushi & Ramen,zRzmTeTnjf7Gm4WQzqd1xQ,5,"I remember when you could walk right in and get sat for dinner. The sushi is amazing and I am happy for them- the staff is awesome. 

The sashimi, specialty...",2019-04-03 17:14:44
1460,Totoyama Sushi & Ramen,zRzmTeTnjf7Gm4WQzqd1xQ,3,"I wanted to like this place more but unfortunately there were a few things that happened that led this review to be 3 stars instead of 5. 
First of all,...",2019-03-28 16:58:40
1461,Totoyama Sushi & Ramen,zRzmTeTnjf7Gm4WQzqd1xQ,5,"I can't believe I've never done a review here yet. Firstly, I live upstairs in the apartment complex above the restaurant. 

It's rare that I go more than...",2019-03-26 13:21:38
1462,Gracie's Pizza,foBzz8XUsfttltHQSmLS3w,5,"I come here frequently. I get my hair cut across the street every 3 weeks, and I often come here for a slice before or after. In my opinion, this is the...",2019-03-30 18:49:51
1463,Gracie's Pizza,foBzz8XUsfttltHQSmLS3w,3,"Yeah, it's NY style, but it's a NY style I'm not into. 

I think there are 2 main kinds of NY style crust. One is thin, crispy and so tasty, you want to...",2019-03-20 11:14:50
1464,Gracie's Pizza,foBzz8XUsfttltHQSmLS3w,5,"Pizza with personality. We like it!!!

Lots of good fresh topping options, by the slice or whole. Vegan pizza was delicious.",2019-03-13 22:23:22
1465,Taste of Tehran,l2TpbvvizsNl-GBCRb8I1A,5,"One of my favorite Persian restaurants in Los Angeles. 
A true hole in the wall for anyone who is walking and / or driving past by. 
Food is fresh,...",2019-03-28 16:35:12
1466,Taste of Tehran,l2TpbvvizsNl-GBCRb8I1A,1,"If you like decent food thrown at your table, this is your spot!
Before even ordering, witnessed another customer recommend that one of the employees do not...",2019-03-22 15:17:57
1467,Taste of Tehran,l2TpbvvizsNl-GBCRb8I1A,5,"My hunger took me to Westwood Blvd""s restaurant row. Browsing the restaurants from their windows one of the most cleanest ones named ""Taste Of Tehran""...",2019-03-21 11:39:06
1468,Zinc Cafe & Market,PMj1TDcrvYTxEXd-g9LcWA,5,"I love Zinc. I live very close by... I come here almost every morning for coffee (faster than Blue Bottle, and you can pull up to the front door in the...",2019-04-08 20:54:18
1469,Zinc Cafe & Market,PMj1TDcrvYTxEXd-g9LcWA,5,"Delicious! The portion here is very hefty, I must say. Which is good! I was super hungry and everything on the menu looked so good. 

Avocado toast was...",2019-04-08 12:56:44
1470,Zinc Cafe & Market,PMj1TDcrvYTxEXd-g9LcWA,1,"To bad service rood people cold drinks 
Bad conversation 
They're racists
Ignore costumers",2019-04-07 20:45:55
1471,Milpa Grille,Wbysqh4S6OlrTy8oRuitpw,5,"FRESH. QUICK. HEALTHY. AFFORDABLE.....

Honestly this place is too good to be true. You NEVER can find a place that's convenient, fast, healthy, fresh, and...",2019-04-03 16:52:13
1472,Milpa Grille,Wbysqh4S6OlrTy8oRuitpw,5,My first experience with this restaurant was through a chicken Milpa Bowl that a friend offered to buy and deliver to me for lunch. I enjoyed it and have...,2019-03-06 13:16:07
1473,Milpa Grille,Wbysqh4S6OlrTy8oRuitpw,4,"Quality Service, food and a most welcomeing atmosphere. Myself I had the milpia salad, and some of the best prepared elotoe, I've had beforehand. To start...",2019-01-22 17:56:01
1474,Buil Samgye Tang,coTzuG6YYIwexqL4BOTeNQ,5,"*** Specialty - samgye tang (chicken-ginseng soup) ***

I first learned about this place from Jonathan Gold's 2012 article ""60 Korean Dishes Every Angeleno...",2019-03-31 00:05:51
1475,Buil Samgye Tang,coTzuG6YYIwexqL4BOTeNQ,5,"When you go inside it doesn't feel like you're in LA! It feels like you're in a completely different place. 

The owner (I think he's the owner) is very...",2019-01-09 16:52:06
1476,Buil Samgye Tang,coTzuG6YYIwexqL4BOTeNQ,5,"My friend that lives in KTown was craving samgyetang so we decided to check this place out.


LOCATION-its in a tiny strip mall and the parking is...",2019-01-05 23:46:04
1477,Hatchet Hall,FfuuxavSBU_umwIVr2r8bw,5,"very good and interesting food
but the dishes are small and expensive
like a tapas place you need to get 5 dishes for two people",2019-03-24 17:36:41
1478,Hatchet Hall,FfuuxavSBU_umwIVr2r8bw,3,Not a huge fan of this sort of setup. The dishes are a bit small so they force you to buy multiples just to get your fill. It also doesn't help that most...,2019-03-11 23:36:34
1479,Hatchet Hall,FfuuxavSBU_umwIVr2r8bw,1,I was hoping this restaurant would be great because the music was lovely and the dimmed lighting made it a cute date spot. But the service here is so...,2019-03-09 18:31:02
1480,Guisados,aPehkzrXIOoIqQzoFyc33w,5,"This location just opened up inside the Markethall foodcourt in K-town, but if you've had Guisados before then you don't even need to read this review. I go...",2019-04-06 15:16:40
1481,Guisados,aPehkzrXIOoIqQzoFyc33w,4,[SERVICE] This location is fairly new and all the employees are really friendly! The store is located on the corner of the tall buildings on Wilshire. It...,2019-02-23 19:08:09
1482,Guisados,aPehkzrXIOoIqQzoFyc33w,4,The food is bomb but it's just too expensive for a 2 bite taco. I'd have to say my favorite is the chicharron taco. It's not the hard kind of chicharron...,2019-02-17 15:28:56
1483,The Boiling Crab,U7-UBPHK44Y_9wyfOmuHuA,5,"This is me and my wife's favorite restaurant. It's a chain, so really all Boiling Crabs are our favorites but no one does it like the BC! The food is served...",2019-04-04 23:12:09
1484,The Boiling Crab,U7-UBPHK44Y_9wyfOmuHuA,5,Good was great along with great exceptional service. My wife and I enjoyed our dinner. They even out the Laker game on the the upon my request. Definitely...,2019-03-23 10:34:51
1485,The Boiling Crab,U7-UBPHK44Y_9wyfOmuHuA,4,"Omg we devoured the food here! 
BUT make sure ready to get dirty hands - don't wear white then you be a barbarian while you eat. 

The fries were also super...",2019-03-22 22:08:58
1486,Cassell's Hamburgers,Q3pwRtT8v8oTCKFEYJgCbg,5,"YUM!!!! I have seen videos of this restaurant on those popular facebook/buzzfeed type vids and I had to come and try it out. 
Came in on a weekday afternoon...",2019-03-30 14:12:32
1487,Cassell's Hamburgers,Q3pwRtT8v8oTCKFEYJgCbg,5,"A great breakfast!  Very hip and fresh.  Staff was friendly and on top it!   

I had the breakfast burrito, but the standard eggs and bacon looked great.",2019-03-30 10:24:39
1488,Cassell's Hamburgers,Q3pwRtT8v8oTCKFEYJgCbg,2,"I was ready to pay a good amount of money to try a delicious burger. It was disappointing.

Burger: I ordered a medium-well patty and my bf ordered it...",2019-03-22 20:18:47
1489,Hoy's Wok Chinese Restaurant,8fnmCiqpLdtU2XvmofwjpA,5,"Great family Chinese spot on Sunset in Hollywood.

Got the Broccoli Beef lunch special which was delicious.  One standout feature was how thinly they sliced...",2019-04-08 16:51:39
1490,Hoy's Wok Chinese Restaurant,8fnmCiqpLdtU2XvmofwjpA,5,"This place is amaaaazing.

Came in earlier this evening with my girlfriend for dinner. Ordered the egg drop soup, xiao long bao, and beef udon...",2019-04-01 21:19:57
1491,Hoy's Wok Chinese Restaurant,8fnmCiqpLdtU2XvmofwjpA,5,Cleanest Chinese restaurant that I've been to in many years.  They have two large screens and they'll play the popular games.  Food comes out very quickly...,2019-03-31 11:56:30
1492,Leo's Tacos Truck,ra8QFgeKZYNRaYABohgHNg,5,"This truck is a go-to whenever I'm visiting my boyfriend in LA. 

We came here for Valentine's Day after seeing an episode of Munchies on YouTube and while...",2019-03-28 16:59:03
1493,Leo's Tacos Truck,ra8QFgeKZYNRaYABohgHNg,4,"With all the taco trucks out in LA it's hard to find a really good spot to grab your late night tacos.

But rest assured that you won't leave disappointed...",2019-03-28 12:33:14
1494,Leo's Tacos Truck,ra8QFgeKZYNRaYABohgHNg,4,"This neighborhood taco truck, complete with smoking al pastor spit, has been hopping every time I've biked past it. Last night after climbing, I decided I...",2019-03-20 12:09:55
1495,Michin Dak,zC__7xADu7cWu-RE6P4Npg,5,"Whoever runs the Instagram page for this place needs a raise, they know what they're doing!

I got a random like on a pic today and started looking at their...",2019-04-02 12:17:26
1496,Michin Dak,zC__7xADu7cWu-RE6P4Npg,5,"Spotted this place on the way down 6th street and catalina... Excited to try there chicken..

ALSO check out YouTube fortnite video she made at michin...",2019-03-28 20:38:46
1497,Michin Dak,zC__7xADu7cWu-RE6P4Npg,4,"Came as an alternative for Dave's Hot Chicken. The vibe was cool and upfront. One thing that's pretty trippy - is that there is no cashier, and nobody...",2019-03-27 20:05:46
1498,All Time,8MaRuBRfR80wN3civ6PpWQ,5,"First timer here. Awesome place to stop by in the morning after a hike at griffith park with the pups!

I had the breakfast burrito:
13$ of potato . Cheese....",2019-04-06 07:53:54
1499,All Time,8MaRuBRfR80wN3civ6PpWQ,2,"Went here for breakfast and I was really disappointed. Got the breakfast burrito, cheesy eggs on toast, avocado toast, and a pastry. 

I didn't like the...",2019-04-01 01:10:37
1500,All Time,8MaRuBRfR80wN3civ6PpWQ,4,All Time has been on our hit list for far too long; I could hardly bare another Instagram photo of the focaccia. Our dinner last night didn't disappoint....,2019-03-31 17:44:41
1501,Broken Shaker Los Angeles,U_r40GZhG6fUpbsFvnK2mg,5,"My first rooftop & it was lovely! 
Cheeseboard, and cauliflower is a must order. 

The waiter was so nice and when suggested which cocktail was best, they...",2019-04-03 18:43:18
1502,Broken Shaker Los Angeles,U_r40GZhG6fUpbsFvnK2mg,2,"Visited last weekend and it was a disaster. Walked in and requested a table via the hostess, were sat accordingly. Waited 20 minutes, no one had been by our...",2019-04-04 10:09:24
1503,Broken Shaker Los Angeles,U_r40GZhG6fUpbsFvnK2mg,3,"I love rooftop bars in LA. This one is on the rooftop of Freehand Hotel. No entrance fee. There are two bar areas to purchase drinks from but to order food,...",2019-04-01 19:57:45
1504,Simone,UlgUVYKpwvOL--0GrSVdfw,4,Have been twice before the removal of Jessica Largey and I can say that it will be a huge loss to not have her cooking in LA (and my home nabe of the Arts...,2019-03-19 10:01:02
1505,Simone,UlgUVYKpwvOL--0GrSVdfw,4,"With the news of Jessica Largey stepping away from the restaurant, it reminded me that I had yet to write my review for this spot on my visit a few weeks...",2019-03-15 12:51:11
