,restaurant,restaurant_id,rating,text,time_created
2205,Flavor Table,Sb_hPko42AEdCbX5Nut5hA,5,"Oh.
My.
Goodness.

Y'all don't even understand how good them shrimp and grits are. That should be ILLEGAL!!! If I could only eat one meal for the rest of my...",2020-06-19 14:47:55
2206,The Six Chow House West Los Angeles,6GoklBhGvonSU_AJpTvexw,5,"The Six has done everything right.  Now, with the pandemic and the Dodgers back in uniform, there hasn't been a place to head out to that is convenient and...",2020-08-26 13:53:19
2207,The Six Chow House West Los Angeles,6GoklBhGvonSU_AJpTvexw,4,The beer garden is perfect for the COVID social distancing. They had live sports playing and great choice of food. Only downside for me is that they do not...,2020-09-12 18:49:34
2208,The Six Chow House West Los Angeles,6GoklBhGvonSU_AJpTvexw,4,This place was a lot of fun and a perfect spot to eat outside during the covid shiz.  We had the price fix dinner and were very happy with the food.   Fried...,2020-09-27 19:39:32
2209,Halal Food Indian Cuisine,UZ0fPngKt0CHVeJe4WfUqg,5,"Located in the corner of the plaza on washington and western. Food was great ordered a chicken curry, garlic naan and 2 chicken samosas. 

The chicken curry...",2020-12-14 12:43:41
2210,Halal Food Indian Cuisine,UZ0fPngKt0CHVeJe4WfUqg,5,"So this is the first time I'm the first person to review so hope it comes out well.  

I happened to come across this gem while coming out from an appliance...",2020-12-04 00:33:08
2211,Halal Food Indian Cuisine,UZ0fPngKt0CHVeJe4WfUqg,5,Found this spot and decided to take a chance with some Indian food. It did not disappoint. The food has a home made feeling to it it's not as greasy as...,2020-12-08 19:54:21
2212,The 3rd Stop,12jL9bVids7OgTm_0_JCbg,5,"Discovered this place during the pandemic for delivery (have never dined-in here). Their food is INCREDIBLE. We order from them about once a month, and have...",2020-09-24 10:58:40
2213,The 3rd Stop,12jL9bVids7OgTm_0_JCbg,4,"The last time I was here was prior to the pandemic, but I am finally writing my review.  The service here was ok; the server we had wasn't the friendliest...",2020-07-10 15:11:26
2214,The 3rd Stop,12jL9bVids7OgTm_0_JCbg,5,Ok my love for this place grew over the years. I have tried different items and so far it's never bad. Staff is always polite and prompt. Food is solid....,2020-10-20 23:41:41
2215,Pita Café,WPoyviCJpBfHpSxkLr0_1w,5,"Covid19 delivery review:
Wow this combo plate was bomb.com. So yummy!! Each meat taste absolutely delicious, very appetizing. Chicken is usually a hit or...",2020-12-03 18:59:17
2216,Pita Café,WPoyviCJpBfHpSxkLr0_1w,5,Ordered takeout from here during the quarantine and the food was excellent! It was ready within 30 minutes of ordering and the portions were large. I got a...,2020-05-18 17:23:17
2217,Pita Café,WPoyviCJpBfHpSxkLr0_1w,5,"Fast & easy online order & pick up. Good food, & service at this location. I appreciate that they never forget pita bread and utensils, Always great.",2020-11-07 09:23:34
2218,Mitsuru Cafe,W72Vw4dDILjmFtSC0z2CCw,5,"Mitsuru cafe is great. Love the imagawayaki. But came by today and even tho Yelp and internet said they were open, they were closed. So now I gotta buy the...",2020-05-20 15:41:39
2219,Mitsuru Cafe,W72Vw4dDILjmFtSC0z2CCw,5,Love getting the hot and fresh red bean cake from Mitsuru Cafe when I am in Little Tokyo.  The taste of the cake batter is always spot on and they seem to...,2020-11-29 10:13:41
2220,Mitsuru Cafe,W72Vw4dDILjmFtSC0z2CCw,4,"Very nice place.  The food was enticing and we could see the display of items through the window as we walked by.  We ordered takoyaki, dango, and a couple...",2020-11-10 16:26:44
2221,The Front Yard,25fipMHUHLZTq0sVQINi5g,5,"The Front Yard is such a great restaurant! After having it on my radar for way too long, I finally decided to check it out, the first time with some friends...",2020-12-01 17:32:33
2222,The Front Yard,25fipMHUHLZTq0sVQINi5g,5,"I absolutely love The Front Yard! I've gone for breakfast, brunch, and dinner and the only meal I've missed has been lunch...and I can imagine if it's as...",2020-11-22 22:08:54
2223,The Front Yard,25fipMHUHLZTq0sVQINi5g,5,Beautiful restaurant with a large outdoor patio dining area which is nicely spaced out from other tables.  Parking is in their own lot and free.  They take...,2020-11-22 09:44:31
2224,Olympic Noodle,Qo4F-RObp5GXE_-vZXzD5g,5,"Lemme tell you. 
I've been coming here since the early 90s. The place has gone through one ownership change in early 2000s. 

Their chicken...",2020-07-14 09:50:35
2225,Olympic Noodle,Qo4F-RObp5GXE_-vZXzD5g,5,My wife and I were pleasantly surprised by the friendly reception plus the generous and delicious chunky chicken noodle and dumplings we've ordered. We'll...,2020-12-13 06:11:31
2226,Olympic Noodle,Qo4F-RObp5GXE_-vZXzD5g,4,"Specialty: Dak kal gook soo (sliced noodle soup with chicken)

I first learned about Olympic Noodle from one of Jonathan Gold's articles...",2019-10-26 22:56:04
2227,Roscoe's House of Chicken & Waffles,g-UI37EnWkqBfoRIiHFohw,5,"I would like to think as myself to be a chicken connoisseur. I will admit, my expectations of Roscoes chicken and Waffles were pretty high. Coming from...",2020-11-14 15:17:20
2228,Roscoe's House of Chicken & Waffles,g-UI37EnWkqBfoRIiHFohw,5,"Safety precautions are enforced upon arrival . 
Security man is great on social distancing costumers and applying hand sanitizer . 

Keyante taking orders...",2020-10-29 15:42:22
2229,Roscoe's House of Chicken & Waffles,g-UI37EnWkqBfoRIiHFohw,4,"Whenever I'm in LA, Roscoe's House of Chicken is a must! Chicken is always moist and the waffles are fluffy and buttery. My go-to is the Obama's specials...",2020-07-29 21:26:27
2230,Simply D'Licious,uJK1SCcuw4y5stmMKFFmtg,5,Everything my friends and I ordered for carry out tasted great. The people in line were friendly and even shared what they usually get from this place. The...,2020-06-25 03:08:34
2231,Simply D'Licious,uJK1SCcuw4y5stmMKFFmtg,5,This place came highly recommended from a friend and it did not disappoint!  Due to COVID-19 it's takeout only and you will wait 20 minutes but it's worth...,2020-09-02 21:58:01
2232,Simply D'Licious,uJK1SCcuw4y5stmMKFFmtg,5,"Just grabbed their hot and ready breakfast buffet meal. So good! Eggs, bacon, potatoes with peppers and onions, and a fluffy biscuit. Everything was hot,...",2020-10-04 11:00:35
2233,BESTIES Vegan Paradise,gI4tD4t2Uyb-NqeBitfXGA,5,"I just can't send Besties enough love. It's a literal one-stop-shop for all things vegan, an outpost for anyone on the vegan spectrum. Been vegan a long...",2020-08-18 15:01:03
2234,BESTIES Vegan Paradise,gI4tD4t2Uyb-NqeBitfXGA,5,This is my absolute favorite vegan market. The food selection is always fantastic. I am always delighted with the new finds and the staff suggestions!...,2020-12-12 10:39:14
2235,BESTIES Vegan Paradise,gI4tD4t2Uyb-NqeBitfXGA,5,I love BESTIES. It's been a bright light in my pandemic life. A wide variety of artisan cheese and Lagusta's Luscious chocolates fill me with absolute joy....,2020-08-11 00:05:05
2236,moonbowls,s00ZAKyu-rjpKsr3m6ReGA,5,"Moonbowls brings together an innovative concept with great, healthy food.

Scrolling through the healthier options on DoorDash, I was quickly drawn to...",2020-05-18 22:54:14
2237,moonbowls,s00ZAKyu-rjpKsr3m6ReGA,5,"At first I ordered this because I love anything about the 'moon' so yeah this name tempted me :P
AND ITS GREAT !
I ordered it and the delivery package was...",2020-07-16 20:34:16
2238,moonbowls,s00ZAKyu-rjpKsr3m6ReGA,5,I love this place.  I have not been because of COVID but have ordered 3 times since I found it.  The bowls are great and the cauliflower appetizer is...,2020-08-09 17:52:35
2239,Mariscos 4 Vientos,im2Dqafry4edoq2DKsAcnQ,5,This place!! The only place I really trust with mariscos! Ive been going to this place for years! Their campechanas are always on point. I never have to add...,2020-09-30 01:31:28
2240,Mariscos 4 Vientos,im2Dqafry4edoq2DKsAcnQ,5,What I look mostly about 4 vientos is their aguachiles the best. Aguachile Verde Tostada thats the one but I usually ask for take out and they provide you...,2020-12-02 13:51:43
2241,Mariscos 4 Vientos,im2Dqafry4edoq2DKsAcnQ,5,"Local joint known for shrimp tacos. My dad absolutely loves this place, so we were excited to see that they're still open for takeout during coronavirus. If...",2020-05-11 20:56:57
2242,Tacos Delta,j63ipopHrhHHnoy9Ac5m0g,4,"More americanized than authentic street tacos, but their beans are amazing! 
Their patio is opened for outdoor sitting, but they give it to you in take out...",2020-11-11 08:03:45
2243,Tacos Delta,j63ipopHrhHHnoy9Ac5m0g,4,"Taco spots are as abundant as sunny days here in Southern California, but all of the best ones I've had are from shopping carts on the street. For a brick...",2020-11-10 09:57:45
2244,Tacos Delta,j63ipopHrhHHnoy9Ac5m0g,5,TL;DR - Banging Mexican food. Chilaquiles on point. Funky and fun outdoor decor. Reasonable prices. COVID-19 safe practices and distanced outdoor...,2020-10-18 12:21:28
2245,SUGARFISH by sushi nozawa,lE0ceQRIUrhvfUE8Pg9sXw,5,I've been to SUGARFISH several times and every singer time is just a pleasant experience (whether it's dine in or delivery). I have high standard for sushi...,2020-12-11 12:47:30
2246,SUGARFISH by sushi nozawa,lE0ceQRIUrhvfUE8Pg9sXw,5,"[DURING COVID REVIEW]

I have been to SUGARFISH before and am a big fan. I was back in LA for a bit and wanted to get some great sushi so I knew exactly...",2020-11-12 20:07:19
2247,SUGARFISH by sushi nozawa,lE0ceQRIUrhvfUE8Pg9sXw,5,"Sushi cravings can only be satisfied by Sugarfish - that is law! 
Just kidding-ish but Sugarfish always hits the spot with fresh, great quality fish....",2020-11-11 20:15:21
2248,Berlin Currywurst,CEgXWVuffLS6yjq_O0seVg,4,"The ultimate German street food, it is not easy to find sausages in the United States. I a thankful Berlin Currywurst is in the grand Central Station. 

The...",2020-07-22 06:55:58
2249,Berlin Currywurst,CEgXWVuffLS6yjq_O0seVg,3,I love currywurst - it was my favourite street food to order when I was living in Berlin. I was very excited to learn that this was one of the few places...,2020-01-03 23:18:15
2250,Berlin Currywurst,CEgXWVuffLS6yjq_O0seVg,4,"I love Berlin Currywurst because it is a treat for the soul and the belly. Located right across the way from Egg Slut, this German traditional sausage place...",2019-10-08 00:27:06
2251,Velvet Margarita,3Tfkr7eD4wvd_zr7IhBCwQ,5,"Absolutely love this place for the decor and the food. I'm usually full off of the chips and salsa before I get my food, but it's so good I don't stop!!!...",2020-10-24 01:55:50
2252,Velvet Margarita,3Tfkr7eD4wvd_zr7IhBCwQ,5,"Wow!!! I am so impressed by this place and cannot wait to come back. I found this gem walking around Hollywood, the outdoor display of the Mexican Skull...",2019-08-08 14:07:06
2253,Velvet Margarita,3Tfkr7eD4wvd_zr7IhBCwQ,5,"I've been here twice now and it is one of my favorites and I think a hidden gem.

Let's start with ambiance. Yes, it is really dark in here but I love the...",2020-03-07 18:52:03
2254,Birds,ubAiG5pgaQazJpoFHfViMg,5,"Without a doubt, the best Hollywood restaurant for locals. The food is always delicious., but the best part of Birds are their amazing people. Unbelievably...",2020-08-13 11:27:00
2255,Birds,ubAiG5pgaQazJpoFHfViMg,5,Ordered for delivery and everything was so good. Best chicken & pie I've had in a really long time.,2020-03-23 20:44:06
2256,Birds,ubAiG5pgaQazJpoFHfViMg,5,"Thank you Sean. You are a great manager! 
Your kindness, when I called to confirm my order thru Doordash (because of an error message from doordash) was...",2020-08-25 19:49:12
2257,Lemme Smash Burgers,t3WZtBnCauMWywGc9NJs1g,5,"These burgers are very, very good. We ordered one burger and knew before we were done eating it that we needed to order a second one. A SECOND BURGER. 

So,...",2020-07-26 13:16:17
2258,Lemme Smash Burgers,t3WZtBnCauMWywGc9NJs1g,4,"DOPE burger! Meat flavor is rich and present but not fatty/greasy/chewy. If you're a cilantro person, Ian is generous with his toppings and what an angel he...",2020-08-03 18:35:57
2259,Lemme Smash Burgers,t3WZtBnCauMWywGc9NJs1g,5,"Hidden gem. Walked up on Sunday and ordered a double on a whim. Super good, super unique. Patties reminded me of shake shack, but with some Peruvian flare....",2020-08-04 19:44:31
2260,Tabla By Sofi Restaurant,A9J4E06o1NaT_nKvXf61pQ,5,I'd like to take a moment and write an amazing review for this particular restaurant. During these difficult times its extremely hard to be able to sit down...,2020-10-15 11:40:05
2261,Tabla By Sofi Restaurant,A9J4E06o1NaT_nKvXf61pQ,5,oh my where to begin.  Had date night with my hubby last night here and what it treat it was.  First off it was great to see something new open after...,2020-11-12 06:56:42
2262,Tabla By Sofi Restaurant,A9J4E06o1NaT_nKvXf61pQ,1,"They are not open during the hours posted online. Confirmed my online order at 7pm on a weeknight, and after I received a notification that the food was...",2020-12-09 13:49:01
2263,Love Boat Kitchen,T-oJxnx7vlJYdzFxjOK3FA,5,"We ordered this for pickup and it was delicious.  I've always been a fan of Taiwanese food (having been to Taiwan) but it's impossible to find, especially...",2020-12-14 06:51:46
2264,Elio’s Wood Fire Pizza,3bcwe6fXqraCf3vThCGrxw,5,Another amazing pizza in LA! It is hard to find good pizza. But when you find it in LA you definitely have to enjoy and tell the world about it.  Elio's...,2020-05-16 08:26:14
2265,Elio’s Wood Fire Pizza,3bcwe6fXqraCf3vThCGrxw,5,We're going to eat pizza in a parking lot? Yup... Let me just start off by saying this set up is absolutely amazing. The wood fire  pizza oven is straight...,2020-05-13 14:11:19
2266,Elio’s Wood Fire Pizza,3bcwe6fXqraCf3vThCGrxw,5,"Great pizza! They have two stone ovens and work very fast to deliver simple tasty pizza.  
I had a margarita and a chesse pizza with artichokes and...",2020-08-23 14:35:31
2267,BongChu,O97WUjVSFZqt1GycJZjlMA,5,"First time trying this BONGCHU  chicken and it was very delicious, love the noodles!!!  Also we were taking it to go to Orange County and they were so...",2020-06-26 15:55:52
2268,BongChu,O97WUjVSFZqt1GycJZjlMA,4,"I was craving noodles and ordered delivery from here on a whim recently. I'd never had jjimdak but the pictures looked amazing.

I ordered the smaller size...",2020-07-27 09:46:17
2269,BongChu,O97WUjVSFZqt1GycJZjlMA,3,"I had a dinner on weekend Sunday night, we had boneless braised chicken with rice cake. It wasn't that busy, there were only 3 tables. 

Pros: the food...",2020-02-16 19:45:32
2270,Lemonade,bdHCyyGuBWQqw47VMhJGdg,5,"I wish there were photos. But the truth is that I always scarf down my delicious tasty food &, honestly, I have no regrets. 

Lemonade are some folks who...",2020-07-21 15:46:56
2271,Lemonade,bdHCyyGuBWQqw47VMhJGdg,3,Decent place to grab food - only thing is it can add up to be pretty costly but I love the salads and sandwiches,2020-07-06 09:02:09
2272,Lemonade,bdHCyyGuBWQqw47VMhJGdg,4,"Today was the Hatch Green Chili Chicken Bowl.

Flavors of the chicken were great, nice little bit of heat. The rice paired off well with the dish.

The corn...",2019-11-25 13:47:29
2273,Le Petit Greek,2ptYhY0gxay6PwdCzAsTmw,5,This place is incredible. I grew up in the area and have been coming here since I was a little kid- now every time I'm back in LA I try to come here at...,2020-08-05 12:07:32
2274,Le Petit Greek,2ptYhY0gxay6PwdCzAsTmw,5,"If I could offer 10 stars, or 100 stars, that would not be enough for this magnificent restaurant and it's equally magnificent cuisine! Nestled in the...",2020-08-05 15:22:24
2275,Le Petit Greek,2ptYhY0gxay6PwdCzAsTmw,5,We just ordered take-out from Le Petit Greek during the Covid-19 quarantine. Overall it was delicious and prepared on-time/quickly. We ordered the...,2020-03-22 18:16:19
2276,Daikokuya Sawtelle,UlOdAUpnTWYbg5KJhKVdpg,5,"I love, love, love Daikokuya's ramen and think about it every time I am in LA. We ordered takeout (because covid), and I decided to get the tsukemen....",2020-12-11 10:43:22
2277,Daikokuya Sawtelle,UlOdAUpnTWYbg5KJhKVdpg,5,"Out of all the ramen places in Sawtelle, Daikokuya is my favorite because of the ambience and the richness of the broth. I always get the Daikokuya ramen...",2020-12-05 14:10:49
2278,Daikokuya Sawtelle,UlOdAUpnTWYbg5KJhKVdpg,5,"I've dined here in the past (pre-COVID) and the wait is usually a lot better than the Little Tokyo location. Plus there's a parking structure, which is a...",2020-10-04 15:21:36
2279,Locanda Veneta,9CVqDuk5475QzAEunj_7lA,5,"We had a late lunch today at Locanda Veneta. They have ""pandemic seating"" outside. The food is sensational, and the service is friendly, efficient and...",2020-08-26 18:14:11
2280,Locanda Veneta,9CVqDuk5475QzAEunj_7lA,5,I was across the street finishing up on my doc appt and I had to come stop to see what all the good fuss was about this place.  Any toem I go to a Italian...,2020-12-12 10:07:32
2281,Locanda Veneta,9CVqDuk5475QzAEunj_7lA,4,"I wanted to give it a 5 stars, but the lamb shank I ordered was not too flavorful.. it was flat. I had to ask for hot sauce to make it more exciting. Our...",2020-10-20 23:37:49
2282,Isaan Station Thai Street Food,Q-7u7kPhVeGYV8DdKbj02A,4,"When I was still living in Koreatown, I loved taking a short walk from my apartment to pick up some Thai food nearby. My go to was always the pad see ew....",2020-09-20 21:26:44
2283,Isaan Station Thai Street Food,Q-7u7kPhVeGYV8DdKbj02A,5,"ONE OF THE BEST PLACE TO GET PAPAYA SALAD WITH BLUE CRAB HANDS DOWN. 
I've been coming here for a year-ish and been ordering a bunch of to-go since COVID....",2020-09-11 12:50:13
2284,Isaan Station Thai Street Food,Q-7u7kPhVeGYV8DdKbj02A,4,"If you're looking for a restaurant that knows what ""Thai spicy"" is, Isaan Station is the spot. This was my second try using Uber eats, the first time, I...",2020-04-08 22:02:06
2285,Koreatown Pizza Company,clJmJd_tbaK34j1CN-9MYQ,5,"I love that social media allows businesses connect to their followers. I found them and have been itching to try their pizza. 

The drive into kTown is not...",2020-11-08 20:08:41
2286,Koreatown Pizza Company,clJmJd_tbaK34j1CN-9MYQ,5,During this time of Covid19 I haven't ventured very much to try anything new but have been sticking mostly to cooking at home or sticking to my favorites...,2020-08-30 14:47:02
2287,Koreatown Pizza Company,clJmJd_tbaK34j1CN-9MYQ,5,"I love eating here! It's so delicious, I would come before quarantine and still order during quarantine. The service is always phenomenal. I've tried many...",2020-07-28 22:38:27
2288,Tokyo Hamburg,Y6fIDAmbM7cvnZsbOWFb-w,5,"Order:
Original Hamburg Steak 
Beef Tataki
Sapporo Beer ($4 all-day happy hour!)

Hands down one of the best spots in LA for Japanese food! I was a bit...",2020-11-24 18:15:39
2289,Tokyo Hamburg,Y6fIDAmbM7cvnZsbOWFb-w,5,"Trendy and cool layout of the restaurant. They have some pretty neat designs, and posters that makes it look like you are actually dining at a Japanese...",2020-10-27 20:49:17
2290,Tokyo Hamburg,Y6fIDAmbM7cvnZsbOWFb-w,5,"Meat is pretty bomb. 

Dollar Oysters. 
You can grill your own burger or have them do it for you. (You get more if they cook it for you)

The Beef Gyukatsu...",2020-10-16 12:28:31
2291,El Guanaco Restaurant,_9eQldnHu-amupjQx7_u4A,5,My family and I have been coming here for years. Best place to get delicious pupusas and authentic Salvadoran horchata. We also love how affordable their...,2020-12-08 23:48:51
2292,El Guanaco Restaurant,_9eQldnHu-amupjQx7_u4A,5,Somehow I managed to live **COUGH** number of years on this planet and had never had a pupusa. Enter El Guanaco to the rescue. One Pupusas Revueltas (Corn...,2019-11-04 21:13:20
2293,El Guanaco Restaurant,_9eQldnHu-amupjQx7_u4A,4,"4.5

Randomly walked into this hole-in-the-wall CASH ONLY El Salvadoran restaurant in East Hollywood (great for Mexican and Central American food), and I...",2018-11-27 07:01:53
2294,El Taurino,KMZKgZCy6jJ3vbP_XL8rHA,5,"Great spot for some good tacos, but getting in line is a hassle. Highly recommend postmates delivery.",2020-07-26 12:35:26
2295,El Taurino,KMZKgZCy6jJ3vbP_XL8rHA,5,"During this pandemic, I decided to stop by and pick up some food. They limit the number of people that are inside the restaurant while the rest wait...",2020-06-05 20:37:53
2296,El Taurino,KMZKgZCy6jJ3vbP_XL8rHA,5,"Like other Yelpers, El Taurino, carries childhood nostalgia. I remember delicious carne asada tacos, horchata, and long lines. None of those things have...",2020-12-06 18:27:22
2297,Golden State,DryPvekrxsqbpOJNOajRpA,5,Best burger in town.  Even with Covid they are super easy to order from and have great service.,2020-11-17 18:51:25
2298,Golden State,DryPvekrxsqbpOJNOajRpA,5,"When the delivery burgers are just as good as eating them in the restaurant, they definitely deserve 5 stars. As a pescatarian, the suggestion of burgers...",2020-06-09 21:02:40
2299,Golden State,DryPvekrxsqbpOJNOajRpA,5,"OK, so I got some takeout from here during quarantine.  Just craving a burger and dreading being disappointed by soggy fries being delivered 40 minutes...",2020-09-28 11:07:00
2300,My Thai,mcL8IfhJKfxxCAGoRswnGQ,4,"I don't usually stray from my go-to Thai spots, but I've gotten My Thai a couple of times this year and have been pretty pleased with both the delivery and...",2020-11-25 16:25:37
2301,My Thai,mcL8IfhJKfxxCAGoRswnGQ,4,I ordered take out from here and it was ready in 30 min. I got the pad kee mao noodle with beef and it was so tasty! The perfect level of slickness. I also...,2020-11-08 21:22:27
2302,My Thai,mcL8IfhJKfxxCAGoRswnGQ,5,I ordered through delivery and my food was still warm. Really good pad thai! The food arrived at an earlier expected time.,2020-11-15 09:37:57
2303,Blossom Restaurant,yNBlfI0twfw2-r8Chsgdfg,5,"We've been ordering takeout from here and it's so good. The shaken beef has excellent flavor and is very tender, comes with a salad with an acidic dressing...",2020-08-25 13:17:00
2304,Blossom Restaurant,yNBlfI0twfw2-r8Chsgdfg,1,"I ordered take out, and I'm not sure if this is typical but I got a raw hunk of meat sitting next to the noodles.  The noodles was soaked in blood, and I...",2020-08-05 16:54:19
2305,Blossom Restaurant,yNBlfI0twfw2-r8Chsgdfg,2,This long-standing Vietnamese restaurant has been in downtown LA since 2006 and I had this place bookmarked at least 5+ years ago. They opened few...,2019-05-04 11:39:10
2306,KyoChon,dWoQPRhhHPBAssKJy9MpBw,4,"Ordered SoyGarlic and Red Wings (large) wings to go online - they were approximately $25+. When I went to pick it up, parking was super easy as there's a...",2020-12-11 18:55:17
2307,KyoChon,dWoQPRhhHPBAssKJy9MpBw,5,"Soy Garlic and Red Wings! The red wings aren't the same as normal buffalo wings. They're slightly sweet and spicy. Super bomb! 

Soy Garlic is still my fav...",2020-10-07 01:32:55
2308,KyoChon,dWoQPRhhHPBAssKJy9MpBw,5,"I love KyoChon, plain and simple. They consistently have the best Korean wings I've had, and I've tried a lot of different places in the LA area. The sauce...",2020-11-09 08:30:09
2309,Chef Marilyn's,0hddg8pBXwnGog0bmmIm9w,5,I love this place everything I have had has been very good. I've had turkey wings fried chicken Mac and cheese cabbage greens yams short ribs flanken ribs...,2020-07-19 14:02:06
2310,Chef Marilyn's,0hddg8pBXwnGog0bmmIm9w,5,"This place is a gem !

The food was so satisfying and delicious! Excellent, excellent, excellent.

The chicken was crunchy and juicy and the mac n cheese...",2020-08-08 20:17:34
2311,Chef Marilyn's,0hddg8pBXwnGog0bmmIm9w,2,"Too hot to hot to be waiting outside in the sun. The food was tasty, but I gotta score low b cuz of the wait.  Shoot, pug a tent out or some mist sprayers....",2020-08-29 11:59:33
2312,Tara's Himalayan Cuisine,kbgEwipbXeu3fAbornL96g,5,"Tara's is fantastic! I've been coming here and ordering delivery for at least 15 years, since they had their single location in Venice. It's one of the most...",2020-11-06 22:44:33
2313,Tara's Himalayan Cuisine,kbgEwipbXeu3fAbornL96g,5,"Tara is the owner / chef of Tara's Himalayan's cusine on Venice Blvd in Culver City & In Santa Monica .
A mix flavor of Indian and Nepali food what a treat...",2020-07-26 15:11:41
2314,Tara's Himalayan Cuisine,kbgEwipbXeu3fAbornL96g,5,"The korma here is so special! Get it with chicken or vegetables, it doesn't matter... it's amazing. The paneer and saag is also delicious. I've been dining...",2020-12-02 00:26:01
2315,Natalee Thai Restaurant,3jQBLJqoOeajjwVjewYIzg,5,"I ordered on a friend's recommendation and I was fully satisfied. They take full precautions with you during the ordering process. If you need a menu, you...",2020-07-22 10:35:42
2316,Natalee Thai Restaurant,3jQBLJqoOeajjwVjewYIzg,5,I was craving a good wonton soup. Ordered through grubhub two servings asking them to leave out the chicken slices.  The order came way faster than was...,2020-10-19 20:36:18
2317,Natalee Thai Restaurant,3jQBLJqoOeajjwVjewYIzg,4,"This review is jut for the Pad See Ew:
This is my go-to dish for Thai food...I order it ALL the time anytime I order Thai. For some reason I have been...",2020-12-03 22:02:28
2318,Krack N Krab,MltwcufAgZHUftzJhFEfKw,5,"I always passed by this restaurant on Western, and I finally got the chance to go. I'm so glad that I checked it out because it'll definitely become one of...",2020-11-01 18:34:59
2319,Krack N Krab,MltwcufAgZHUftzJhFEfKw,5,"Got combo B to go for a ""date"" night. Definitely a lot of food for two people. ( think it is more for 3-4 people). Staffs are very nice. It was my first...",2020-10-13 19:22:24
