,restaurant,restaurant_id,rating,text,time_created
694,Pa Ord Noodle,adrzBN4C3jpoCAzJX-xscw,5,I've been going to pa ord for many years (dining and take out) and will still give them 5 stars but recently just did a take out. Tried calling to let them...,2020-09-01 12:16:55
695,Pa Ord Noodle,adrzBN4C3jpoCAzJX-xscw,5,"My go-to THAI restaurant! I ordered many times during this quarantine period and their food quality is as good as usual, fast, and they didn't really raise...",2020-07-26 20:07:57
696,Pho Saigon Pearl,CXmJB5LZeda27UeBGzk75Q,5,"I've been at this place maybe around 50 times in the past 4 years but how come never wrote a review? They are amazing in every way. Creative, friendly,...",2020-12-10 15:19:14
697,Pho Saigon Pearl,CXmJB5LZeda27UeBGzk75Q,5,The pho broth was flavorful and delicious. I had the Vegetarian pho and my boyfriend got the Filet Mignon Pho with Chicken added to it. I was Gad to see a...,2020-10-10 19:18:38
698,Pho Saigon Pearl,CXmJB5LZeda27UeBGzk75Q,5,Coming from Philadelphia and this was a great spot for fresh and very good tasting pho!  Great for delivery.,2020-11-13 21:42:27
699,California Chicken Cafe,W8RQPUOgLC7d_kO0h3B_QA,4,"Excellent food. We ordered the Chinese Chicken Salad, the chicken rice wrap and the vegan crunchy wrap.

Very clean, very good and excellent delivery. Must...",2020-11-08 10:29:43
700,California Chicken Cafe,W8RQPUOgLC7d_kO0h3B_QA,4,"We ordered delivery at work. My coworkers are fans, so I wanted to try it too. Prices are very affordable. I got a chicken salad with pasta, avocado, feta...",2020-10-21 01:53:33
701,California Chicken Cafe,W8RQPUOgLC7d_kO0h3B_QA,5,I was looking in the internet to find some good and healthy places too eat when I stumbled upon this location. The drive wasn't too bad so I decided too try...,2020-10-13 13:32:00
702,Hinoki & The Bird,0O1PywQt1i2APvECFSSoBw,5,"This is a romantic hidden gem in Century City.  You're not going to stumble upon this restaurant, as it's off the street & tucked away.  You have to be in...",2020-10-21 14:16:01
703,Hinoki & The Bird,0O1PywQt1i2APvECFSSoBw,5,"This is a beautiful spot, very nice outdoor patio.  Came her during COVID, sat outside, no touch menus (scan a QR code), comfortable distance from other...",2020-09-24 11:03:46
704,Hinoki & The Bird,0O1PywQt1i2APvECFSSoBw,5,Made a reservation for dinner at this spot a few weeks ago and was pleasantly surprised by how good the food was here. They have taken a lot of precautions...,2020-11-28 16:09:11
705,The Terrace,95Lnd5KJcOJJVrLDLYrDjg,5,"The Terrace is a cafe, restaurant with a garden setting view within The Maybourne Hotel in Beverly Hills.

This space held many previous restaurants, mainly...",2020-08-17 13:35:31
706,The Terrace,95Lnd5KJcOJJVrLDLYrDjg,5,"Absolutely love The Terrace and it's wonderful customer service! Specially thankful for Lisa for her kindness, professionalism, and lovely suggestions. The...",2020-10-29 14:44:34
707,The Terrace,95Lnd5KJcOJJVrLDLYrDjg,5,"I came in and ordered the half moon crab and peaches and I saw one of the handsome chefs wearing his mask and gloves while he was preparing my food, I went...",2020-10-19 19:17:34
708,Papilles Bistro,_NEcYN1YhwHnkFsXlSTdHw,5,"I've been a longtime and very satisfied customer of Papilles, so it came as no surprise that their lunch burger (or fried chicken sandwich) service, branded...",2020-10-26 16:59:31
709,Papilles Bistro,_NEcYN1YhwHnkFsXlSTdHw,5,Totally crushed a Double Bacon Cheeseburger and fries a couple days ago from this french inspired bistro. They accommodated my request to pay over the phone...,2020-09-14 22:29:25
710,Papilles Bistro,_NEcYN1YhwHnkFsXlSTdHw,5,"I've been a fan of this Michelin rated French restaurant since it's opening and used to eat here when I could afford to, for special occasions and...",2020-05-17 10:01:13
711,Shekarchi Restaurant,ltt8RYM6nxMfDTDM6RmrBA,5,"I have had the pleasure of dining in prior to the COVID-19 pandemic as well as ordering food for pickup during the pandemic. The interior is clean, warm,...",2020-07-04 00:01:01
712,Shekarchi Restaurant,ltt8RYM6nxMfDTDM6RmrBA,5,The dark meat kebab meal is yummy. The owner and his staff are very friendly. There's  outdoor dining during COVID,2020-10-10 16:47:30
713,Shekarchi Restaurant,ltt8RYM6nxMfDTDM6RmrBA,5,"My company orders delivery from this location, the food is really good. Ive had the chicken a few times and its great. They give you big portions, rice,...",2020-07-31 13:32:59
714,Ackee Bamboo Jamaican Cuisine,fDIERa8MupwJMTJ97upAPg,5,"During quarantine we've been cooking everything but i woke up today craving jerk chicken. Ordered to go from here, got home, opened my takeout box and...",2020-07-09 15:51:57
715,Ackee Bamboo Jamaican Cuisine,fDIERa8MupwJMTJ97upAPg,5,Amazing food and friendly service! Very COVID aware and respectful! I had the jerk shrimp and oxtail combo - ridiculous - the meat fell off the bone and the...,2020-04-17 20:34:18
716,Ackee Bamboo Jamaican Cuisine,fDIERa8MupwJMTJ97upAPg,5,"Delicious, spicy, jerk and BBQ jerk chicken. Large portions, rice and peas are on point as is the cabbage and veggies. Also the escovich snapper is a whole...",2020-08-29 17:36:20
717,Farmhouse,1nV2NBbRXiWYqjSNcSsYWA,5,"It was a rainy day in Los Angeles, yes really! It was actually a gray, cold, drizzly day in the southland and after a lazy afternoon of wandering around the...",2020-03-26 18:21:35
718,Farmhouse,1nV2NBbRXiWYqjSNcSsYWA,4,"Wow! Loved the experience 


Farmhouse is one of those places you will be happy with  o matter what you order! I had their Heirloom Grain Salad and their...",2020-04-25 10:42:44
719,Farmhouse,1nV2NBbRXiWYqjSNcSsYWA,1,"I ordered through DoorDash and after an hour and a half, it got cancelled and I did not get the food. 

After an hour, I called the store directly and no...",2020-10-19 18:40:57
720,The Bun Shop,k8xtuersBm2cZl0Lao2K5g,5,Discovered this place because of the NBA Finals. We were trying to find a place that had a large TV and also honored social distancing practices. We would...,2020-10-25 18:35:16
721,The Bun Shop,k8xtuersBm2cZl0Lao2K5g,5,"*  *⁣
*⁣
 hey foodie friends! Do you know what the burger  said to the bun? I'll meat you in the middle . We were in Ktown LA recently and came across   ....",2020-08-23 18:22:09
722,The Bun Shop,k8xtuersBm2cZl0Lao2K5g,5,"Ordered delivery during quarantine and was amazeddd! Was worried that it'd get soggy but the food was still really good when it got here. 
I got a beyond...",2020-05-16 14:50:00
723,Soowon Galbi KBBQ Restaurant,9FuxqbYXM0vaPnzrQ7B_qQ,5,"Unfortunately we couldn't dine in their outdoor dining because it had been banned due to alleged rises in COVID cases, putting LA County back into the Red...",2020-11-26 20:23:29
724,Soowon Galbi KBBQ Restaurant,9FuxqbYXM0vaPnzrQ7B_qQ,5,"Small parking lot. They used to use valet, but with the pandemic, it's self parking.

There are 8 tables for outdoor seating and under shading. They've...",2020-11-09 18:24:34
725,Soowon Galbi KBBQ Restaurant,9FuxqbYXM0vaPnzrQ7B_qQ,5,"After all these years. Still good and I felt it got better. The service was very attentive even though they said we had to handle cooking the meat, we...",2020-12-06 15:23:45
726,Zankou Chicken - Hollywood,GClRpiOELwMXxodrS-FN6Q,4,"LOVE Zankou Chicken.  Been a fan for YEARS.

First time back at this location in a long, long time.  Prefer the one in Glendale because it's newer and looks...",2020-06-28 12:27:22
727,Zankou Chicken - Hollywood,GClRpiOELwMXxodrS-FN6Q,5,This place is one of my absolute favorites when it comes to chicken and Mediterranean food . The place is clean and secure especially during the coronavirus...,2020-05-31 00:56:00
728,Zankou Chicken - Hollywood,GClRpiOELwMXxodrS-FN6Q,5,Zankou never ever disappoints!!! I ordered the falafel as well :) super yummy! I am especially impressed by the flow of Zankou chicken during the COVID-19...,2020-05-29 17:34:17
729,Open Sesame,CTFZnhYe6t2tLv_NLHiE-w,5,Delicious chicken tawook and shawarma!  Love the garlic sauce that is served with the plates or pita sandwiches and the little sour pickle slices!  Yum!...,2020-10-26 03:35:58
730,Open Sesame,CTFZnhYe6t2tLv_NLHiE-w,5,"I go to the restaurant regularly and I'm pleased to report this place has been killing it for me during the lockdown, after eating home-prepared food for a...",2020-04-23 14:32:14
731,Open Sesame,CTFZnhYe6t2tLv_NLHiE-w,5,Ate lunch on the patio and it was the best.  Even on the hottest day of the summer and current covid conditions.  They have misting fans that cool the temp...,2020-07-17 19:50:58
732,Figueroa Philly Cheesesteak,vfHJzF0ShYtwmotXE-0PiA,5,Amazing fried chicken sandwich. I got both the buffalo and original d-wich. The coleslaw and pickles are super crunchy and goes perfectly well with the...,2020-09-01 14:07:44
733,Figueroa Philly Cheesesteak,vfHJzF0ShYtwmotXE-0PiA,5,"I've ordered here a few times via their drive through. Guys that work there are always super nice. Even though I've had my share of wrongfully made orders,...",2020-06-27 01:38:01
734,Figueroa Philly Cheesesteak,vfHJzF0ShYtwmotXE-0PiA,5,Great philly cheese steaks! Right next to LAFC so if you are tailgating great spot to pick up food. Fast and a Tasty!,2020-05-26 19:34:20
735,Belizean Paradise,ZV1cQKQfJBaG0Btm1-CArQ,5,"I loved getting a take-out lunch from Belizean Paradise! The service was amazing, the wait wasn't long, and the price was so reasonable. 
The quality of the...",2020-10-16 12:43:51
736,Belizean Paradise,ZV1cQKQfJBaG0Btm1-CArQ,5,"Everything is good here and the service is so friendly. 

If you want to order pick up, call the restaurant. They don't get notified when you order through...",2020-08-22 11:56:01
737,Belizean Paradise,ZV1cQKQfJBaG0Btm1-CArQ,5,"If you're looking for an ""is the food good?"" kind of review, short answer: Y E S 

Now a story about the customer service: 
Been here a million times...",2020-09-17 16:43:29
738,Madre Oaxacan Restaurant and Mezcaleria,MjWMuWJNlxNXr-KmAXL8KQ,5,I had to go meet a client for a short meeting at my office around noon so I treated myself to a curbside drive-by take out at Madre Oaxacan Restaurant and...,2020-11-14 21:45:55
739,Madre Oaxacan Restaurant and Mezcaleria,MjWMuWJNlxNXr-KmAXL8KQ,5,Highly recommend for both the food and cocktails.  Restaurant is offering both takeout and delivery through partner apps during stay-at-home.  I was looking...,2020-04-15 08:23:31
740,Madre Oaxacan Restaurant and Mezcaleria,MjWMuWJNlxNXr-KmAXL8KQ,5,Could've tossed in 1 more taquito but very tasty! Great portion size on the ceviche for the price and I loved the flan! I was very happy taking out and had...,2020-05-04 17:34:16
741,La Pupusa Urban Eatery,cywwDn2SYCoef0PUYOXygw,5,"This is the BEST Salvadoran restaurant in Pico-Union, hands down. Whether you're eating in or doing takeout, my experience with the quality and taste of the...",2020-06-10 14:38:00
742,La Pupusa Urban Eatery,cywwDn2SYCoef0PUYOXygw,5,Found them on IG and I've been wanting to try their pupusas for quite some time. Can I just say... they did not disappoint! I ordered a dozen pupusas...,2020-04-09 19:22:52
743,La Pupusa Urban Eatery,cywwDn2SYCoef0PUYOXygw,5,Call or order online. This spot is amazing. Food is amazing and service amazing. They are a local small business with amazing Salvadorean food with a twist....,2020-07-04 12:46:03
744,Escala,N05X5dnwzpWvLg7ZRcMtcA,4,"Friends in town visiting wanted to check this place out. We ordered two of the sampler plates to share with the table, as well as the cookie dessert, and...",2020-11-18 09:40:47
745,Escala,N05X5dnwzpWvLg7ZRcMtcA,4,It's my second attempt at trying Colombian food. And with the surprise that it had a kick of Korean ! We got the bandeja which is a combination of...,2020-11-07 13:10:54
746,Escala,N05X5dnwzpWvLg7ZRcMtcA,4,"Escala had a great lively ambience. The wait was a bit long and there was no hostess available to accept waitlist, so you had to post it until a table freed...",2020-10-30 10:36:33
747,Palms Thai Restaurant,7qZBxWisbeVI34gIeNpP1A,5,"The BEST Thai food in ALL of Southern Cali. Also the BEST pad si eu in ALL of California (and Tom Yum Goong). Worth a visit even during the Pandemic!!

On...",2020-10-29 20:08:36
748,Palms Thai Restaurant,7qZBxWisbeVI34gIeNpP1A,5,"After a pretty lackluster previous experience, I was wary about coming back to Palms Thai when a few of my fave Thai restaurants are just around the corner....",2020-11-12 20:27:21
749,Palms Thai Restaurant,7qZBxWisbeVI34gIeNpP1A,4,"I came here for outdoor dining during Covid. The menu is smaller than I remember but most of the dishes are still solid. 

The chicken pad Thai was...",2020-09-09 22:53:52
750,Il Pastaio,59taFywC94rseFrt6J5c3A,4,"I've been a number of times, and will probably wait until post-Covid to come back. I appreciate that they make a lot of the pasta in house. My favorite dish...",2020-11-16 18:22:37
751,Il Pastaio,59taFywC94rseFrt6J5c3A,4,I used to come here a lot years ago but im going to write this review during this difficult time. Their pastas are made fresh and very flavorful. During...,2020-07-12 21:09:09
752,Il Pastaio,59taFywC94rseFrt6J5c3A,5,Sublime.  The whole experience was amazing.  The waite staff were freindly and suggestive.  This is extremely important in the trying times. The food was...,2020-07-30 20:32:16
753,Powerplant Superfood Cafe,fHd8nRgoSpn1_dS9HP6fiw,5,"Placed an order for pick up, the Moroccan bowl was so fulfilling and delicious! Thanks for the recommendation! It was a sautéed salad filled and mix of...",2020-07-30 18:07:31
754,Powerplant Superfood Cafe,fHd8nRgoSpn1_dS9HP6fiw,5,"""Wow. Gen is so incredible! Her customer service is really special, she is as much kind and as she is attentive! She helped me narrow down all of the...",2020-12-07 12:36:30
755,Powerplant Superfood Cafe,fHd8nRgoSpn1_dS9HP6fiw,5,"Um, wowwwww. Just ate here for the first time and I'm impressed. The pesto burger was insane. Every part of it was delicious, and love that it came with...",2020-07-10 18:27:49
756,Cielito Lindo,RY_72fCN2JsR9pbTBJD-LQ,5,"COVID-19 Review. Me the lady stopped by forplo our GO TO Spot. They close at 7:00pm on Fridays, NOT at 5:00pm as stated on their website. YELP is correct...",2020-09-12 21:11:11
757,Cielito Lindo,RY_72fCN2JsR9pbTBJD-LQ,5,Take out is available. Went by on a Thursday evening around 5:40pm and picked up some delicious taquitos and horchata. Parking is free behind the...,2020-09-17 18:16:51
758,Cielito Lindo,RY_72fCN2JsR9pbTBJD-LQ,5,Yes. I saw them on IG and it reminded me of how delicious their taquitos were. Walked over during covid and was not disappointed. They had tape down for...,2020-04-25 21:53:42
759,Rao's - Los Angeles,7e9oi3zq_6pP_LU9YPEXLg,5,"Had a wonderful dining experience here last week from start to finish. Our server was friendly, attentive and hospitable. They recently reopened their patio...",2020-09-09 16:36:29
760,Rao's - Los Angeles,7e9oi3zq_6pP_LU9YPEXLg,5,"My wife and I came to Rao's for our 3 year wedding anniversary dinner. As soon as we walked in, I was happy to see everyone masked up and the restaurant...",2020-08-30 19:05:45
761,Rao's - Los Angeles,7e9oi3zq_6pP_LU9YPEXLg,5,Came here for a much needed date night (our first since quarantine). Fabulous service. Enjoyed delicious cocktails while waiting outside for our table. We...,2020-10-04 19:30:40
762,Chicken N Chips,IEElIOYoPqunZSgUx0h1-g,5,"Australian-inspired comfort food, here in LA!Chicken N Chips arrived last year with something a bit different to offer the competitive chicken scene. Here...",2020-12-02 21:15:23
763,Chicken N Chips,IEElIOYoPqunZSgUx0h1-g,5,"Was waiting a long time patiently for Chicken N Chips to open. Great new chicken spot in an area a bit lacking for options.

The first time I went they were...",2020-08-22 15:33:59
764,Chicken N Chips,IEElIOYoPqunZSgUx0h1-g,5,"Truly the sweetest people you'll ever meet! I love a good place to eat, it being black owned makes it that much sweeter. I've been here a few times and I'm...",2020-11-20 10:57:12
765,Tasty Noodle House,OSqzQvVG_5RFB5EMLA9BXw,5,It always feels like a gamble getting Chinese food outside of SGV but this place is awesome! It gives me Hong Kong Cafe vibes if anybody knows what I'm...,2020-09-18 08:31:56
766,Tasty Noodle House,OSqzQvVG_5RFB5EMLA9BXw,5,I've never actually been to the restaurant in person but this has been my quarantine staple! Uber Eats delivers this place and it's been a life saver. I...,2020-11-14 11:42:56
767,Tasty Noodle House,OSqzQvVG_5RFB5EMLA9BXw,4,"My wife picked up a nice spread of takeout and it was a strong performance all around!

Boiled pork and chive dumplings - slightly thicker skins, but...",2020-07-03 13:09:38
768,Dumpling House,WjuO8PhtqINeWqm-ei8NQA,5,"A hidden gem! Currently open for take out! Everything handmade and you can taste the difference!! Shumai was my favorite! 
And the owner is the sweetest and...",2020-11-09 09:03:53
769,Dumpling House,WjuO8PhtqINeWqm-ei8NQA,5,"I've come to this restaurant pre-covid, but just had takeout tonight, and it was just as good! The lady who works here is the sweetest and so nice. I would...",2020-11-14 01:52:47
770,Dumpling House,WjuO8PhtqINeWqm-ei8NQA,5,"So delicious, I went back twice in a week. 

During COVID I definitely want to support more local, minority-owned businesses. 

Dumpling house is delicious,...",2020-09-21 14:15:05
771,Jang Choong Dong JokBal,S8rXjn2aMaoONx468cWRag,5,"I togo S jokbal for two people.
It was pretty good portion and we enjoyed it.
No smell of pork and very tender jokbal with softness of meat.

Definitely...",2020-12-13 14:29:20
772,Jang Choong Dong JokBal,S8rXjn2aMaoONx468cWRag,5,"Love this spot hidden in the corner of this shopping center. We went around 9pm and it was pretty packed. We got an order of Jokbal (, pig trotters) and 2...",2020-10-17 12:05:24
773,Jang Choong Dong JokBal,S8rXjn2aMaoONx468cWRag,4,Good Jogbal (Pork Feet). Tender and juicy. The seasoning is on milder side which is more traditional compare to much stronger and sweeter trend these days...,2020-09-29 16:21:44
774,Anarkali Indian Restaurant,uteG6HIb4an-y5fFCXWo7w,5,"Anarkali is *the best* Indian food I've found in all of Los Angeles.  With my birthday in a few days and celebrations with friends on hold, I decided to...",2020-12-14 13:07:17
775,Anarkali Indian Restaurant,uteG6HIb4an-y5fFCXWo7w,5,"This is one of the best Indian Restaurants in town! I've been to India so I would say I know my Indian food. The owner is also so gracious, especially...",2020-12-09 16:24:11
776,Anarkali Indian Restaurant,uteG6HIb4an-y5fFCXWo7w,5,Anarkali is our favorite Indian restaurant in the area! We discovered this awesome restaurant during the beginning of the pandemic. Our favorite dishes are...,2020-10-15 16:24:20
777,Majordomo,4Zx7Lw4U6F0sXrV4aiIyqQ,5,"David Chang's brainchild majordomo is the best restaurant in Los Angeles.

They opened for takeout last week (for the first time since late March 2020 due...",2020-07-03 20:22:02
778,Majordomo,4Zx7Lw4U6F0sXrV4aiIyqQ,4,My son recommended this restaurant for birthday dinner. Everything was very good with excellent service.  The restaurant is surprisingly in an industrial...,2020-12-05 21:29:01
779,Majordomo,4Zx7Lw4U6F0sXrV4aiIyqQ,4,"Pre-Covid review 

Was so hard to get reservations but we were able to snag a table for 8 people on a week night. We ordered a variety of dishes including...",2020-11-10 16:02:47
780,Dashijiru,zHmptRuZilo_0QgfHlN7JA,5,"This place is a hidden gem. They keep a low profile but the food is amazing. Food quality is A+++, service is A+++. If it weren't for the pandemic, you'd...",2020-12-07 13:20:52
781,Dashijiru,zHmptRuZilo_0QgfHlN7JA,5,"I have been here several times and always happy to get excellent service. In first I really obsessed by theirs tonkotsu ramen, they care about quality and...",2020-10-06 14:23:42
782,Dashijiru,zHmptRuZilo_0QgfHlN7JA,5,Friday night after a stressful week of work... I was dying for some takeout but the first three places we called were all closed.  Then this popped up on...,2020-04-04 00:34:36
783,My Dung Sandwich Shop,jrRMueuUYTHx94B80qio9g,5,"TL:DR - modest, local market and banh mi shop serving up simple, yet flavorful sandwiches to go.

Picked up 2 banh mis here for $8. Place was popping as it...",2020-08-07 12:53:26
784,My Dung Sandwich Shop,jrRMueuUYTHx94B80qio9g,5,"We've been getting sandwiches here for years now since I was really young it's my families favorite spot to get sandwiches 

They're always great , fresh...",2020-07-23 11:56:35
785,My Dung Sandwich Shop,jrRMueuUYTHx94B80qio9g,5,"Picked up sandwiches, delicious and fresh. Continue to stop by even during these Covid times! We'll be back for sure and supporting Chinatown food culture.",2020-09-18 12:21:02
786,Blu Jam Café,ki5SNb4Lli6uOklz6BXXGw,5,My favorite part about brunch is that you can get sweet and savory dishes at the same time! I usually can't decide so I get one of each (minimum) and then...,2020-12-08 15:40:35
787,Blu Jam Café,ki5SNb4Lli6uOklz6BXXGw,5,"First of all, I appreciate Blu Jam Cafe for taking all the necessary steps in ensuring that their restaurant is COVID compliant. This basically tells me...",2020-08-04 20:41:07
788,Blu Jam Café,ki5SNb4Lli6uOklz6BXXGw,5,Blu Jam is amazing! There's a reason the line is so long. Make sure to grab the crunchy french toast! Great for sharing as an Appy or as a sweet treat all...,2020-06-25 23:21:57
789,Viet On Melrose,hwZ7OfKzqwdX1B4I54XMDQ,5,"Ate here a few months ago, right before the pandemic, and it was some of the best Vietnamese food I've had outside of Vietnam. The owner is also super nice...",2020-07-30 19:57:07
790,Viet On Melrose,hwZ7OfKzqwdX1B4I54XMDQ,5,"10 stars if I could! It's so hard to find authentic, flavorful Vietnamese food around here. Viet on Melrose does not disappoint and always hits the spot....",2020-11-20 10:53:13
791,Viet On Melrose,hwZ7OfKzqwdX1B4I54XMDQ,4,"Hello everyone-

I hope we are all hanging in there!

It's getting to be that time of year. Enough chill in the morning to start throwing on that favorite...",2020-10-31 10:07:50
792,The Factory Kitchen,cK9wMWnQEW9MdYjc-YWueg,5,"Pretty much a perfect place given quarantine.  There's ample parking, the partio is large, the menu is all very flavorful, and the waiters are attentive....",2020-11-11 23:40:56
793,The Factory Kitchen,cK9wMWnQEW9MdYjc-YWueg,5,"We came here in February B-day dinner for my wife and I'm finally getting around to the review. Long over due I know, I know but I took copious notes. Here...",2020-07-17 10:59:49
794,The Factory Kitchen,cK9wMWnQEW9MdYjc-YWueg,2,"Pretty disappointing dinner. We got the calamari pasta- which tasted like canned spaghetti sauce and bought pasta. 

And the truffle pasta which honestly...",2020-10-09 23:16:39
795,Phillips Barbecue,YIR9z52KElQJeCxXFx5pGQ,4,Pick up the phone got damn. I want your bbq but this phone is always busy. Great food here but pick up the phone. Ribs tips and ribs cmon man pick up the...,2020-11-24 14:00:21
796,Phillips Barbecue,YIR9z52KElQJeCxXFx5pGQ,4,"Phillips Barbecue is a decent choice for BBQ in LA.  This is a no frills stand on the west side of Crenshaw, just south of Adams.  During Pandemic 2020,...",2020-04-13 13:15:18
797,Phillips Barbecue,YIR9z52KElQJeCxXFx5pGQ,4,"Solid neighborhood BBQ joint, been going here for over a decade. I always get the 3 meat combo with rib tips, pork ribs and chicken for variety and I'm...",2020-10-22 14:24:39
798,Forage,3e9GNOPdQH6SRxSPkw2FTQ,5,"Social-Distancing Review# 13

Forage is one of my favorite eateries and I am glad they are open for business.

Entrance Door:  Kept open so that patrons do...",2020-04-09 09:07:10
799,Forage,3e9GNOPdQH6SRxSPkw2FTQ,4,"I happened to want chocolate cake, and they had a flourless cake that I wanted to try. While I was disappointed by the cake, I loved the hummus and roasted...",2020-06-08 21:19:31
800,Forage,3e9GNOPdQH6SRxSPkw2FTQ,5,This place never disappoints. I love the salmon bowl and the salmon tacos. Extra pickled radishes because I can't get enough. During COVID they also have a...,2020-07-16 13:18:29
801,Bossa Nova on Sunset,uMY7uC9m7HxRNAZGkjtdbA,4,Food is amazing.  Ordering food can be a hassle if you want extra dressing or something.  Their app doesn't work well and the pickup can be disorganized....,2020-12-04 21:17:31
802,Bossa Nova on Sunset,uMY7uC9m7HxRNAZGkjtdbA,5,"Such a great service, I was really impressed by the staff at bossa nova on sunset.  
First, The security guy was SO friendly and sweet, and even offered to...",2020-11-02 23:05:27
803,Bossa Nova on Sunset,uMY7uC9m7HxRNAZGkjtdbA,5,First time dining here (or out anywhere) since the start of COVID. The wait was only 10 mins and I noticed that social distancing was enforced. We sat...,2020-07-13 02:07:44
804,Poppy + Rose,NlT-6hFP0_6hPo36AW2lIA,5,Amazing food and amazing prompt service. In the midst of a pandemic Kweenie & Anita rolled out the red carpet for me the best they can for my birthday....,2020-11-23 09:37:08
805,Poppy + Rose,NlT-6hFP0_6hPo36AW2lIA,5,"What a lovely #ronastyle Sunday funday experience! 

Make sure you make a reservation. 

Food was delicious, service was wonderful, and the vibe was...",2020-11-10 01:25:13
806,Poppy + Rose,NlT-6hFP0_6hPo36AW2lIA,5,"This place is a hidden gem, in the busy flower district! 

Covid precautions were followed with sanitizer being provided, masks required, and take out...",2020-09-30 11:14:33
807,Social Paella,t9d6aNZ4ynVB6JuFfoAeDw,5,"Social Paella makes the best paella, but our favorite is the seafood.  The dishes are so flavorful and delicious, it makes you want to return for more.  We...",2020-05-16 16:47:46
808,Social Paella,t9d6aNZ4ynVB6JuFfoAeDw,5,"Jesus and his team provided us superb food for our party of 12 this past weekend. From the appetizers to the Paella, everyone agreed the food was delicious....",2020-09-14 09:09:44
