,restaurant,restaurant_id,rating,text,time_created
1393,Oriel Chinatown,9EaRONZCZxomy3TTkLM8DA,5,Me and the girlfriend were in the mood to try something new  and get out of the house so we happened by this place just googling around for places open...,2020-08-19 17:44:58
1394,Oriel Chinatown,9EaRONZCZxomy3TTkLM8DA,5,"Delicious, authentic food. Limited menu but all of the options were tasty! Happy with their patio and  how they're handling the social distancing.",2020-08-19 17:35:41
1395,Oriel Chinatown,9EaRONZCZxomy3TTkLM8DA,5,Great cuisine and amazing service. Most authentic French food I've had in Los Angeles. Would defiantly  recommend the escargot and jar of duck but almost...,2020-08-07 20:16:57
1396,Lory's Restaurant,RaKnMxcrsFtx6ii7yO353Q,5,This place gives a good portion. Ordered beef Lula combo has 2 Lulas plenty of delicious rice and 2 side . Hummus is great! And should get some salad.,2020-10-19 16:02:03
1397,Lory's Restaurant,RaKnMxcrsFtx6ii7yO353Q,5,"Ever since this family owned restaurant opened, I have been  a frequent  patron.  The food is delicious!! The place is clean and the food is beyond fresh....",2020-01-28 13:15:35
1398,Lory's Restaurant,RaKnMxcrsFtx6ii7yO353Q,5,Great food! We cater very often at work and I have to say the food has been consistently tasty. The rice pilaf has to be my all time favorite thing they...,2019-09-29 20:05:19
1399,AL Basch Chicken,BvQqye2Qs18Ig1Qr95f-fA,5,This spot is Covid19 friendly. First thing you see when you walk in is the cleanliness along with multiple markers supporting. Social distancing. The food...,2020-09-15 15:49:06
1400,AL Basch Chicken,BvQqye2Qs18Ig1Qr95f-fA,5,This was a good find! The chicken is delicious and so was the large salad we got. The hummus was good and so was the pita bread. I ordered from here with...,2020-11-30 22:15:15
1401,AL Basch Chicken,BvQqye2Qs18Ig1Qr95f-fA,5,"Covid 19 delivery review:
I think this place deserves 5 stars across the board. I ordered takeout for lunch from DoorDash and it came super quick. I ordered...",2020-06-23 16:14:25
1402,La Esquina,1OXJaygVHAEGooC5gsH_Pg,5,We've ordered pick-up take-out from La Esquina 3 times now. Two times via phone and one time via contactless app (we are only doing contactless now). Each...,2020-07-15 09:31:50
1403,La Esquina,1OXJaygVHAEGooC5gsH_Pg,5,"My favorite local burrito pre-pandemic and loving them now more than ever for continuing to churn out some of the freshest, fastest Mexican food in my neck...",2020-10-16 16:13:27
1404,La Esquina,1OXJaygVHAEGooC5gsH_Pg,5,"I enjoyed my loaded wet chicken burrito. I was allowed to pay over the phone and get curbside service that way I don't have to go in. 

Very affordable and...",2020-07-12 17:57:39
1405,Azay,jcUgGKhk1NbzNBED6e_tPg,5,"The restaurant does a great take out. What do you think? The food is as tasty as my picture.
Check their hours.
Easy street parking for now anyway.

.",2020-12-03 12:51:01
1406,Azay,jcUgGKhk1NbzNBED6e_tPg,5,"This is a really cute, unassuming cafe in Little Tokyo - I came here after reading all the positive reviews about their traditional Japanese breakfast. 

My...",2020-04-08 15:40:13
1407,Azay,jcUgGKhk1NbzNBED6e_tPg,5,Lovely takeout experience with really great service! The staff at the curbside when we picked up were so kind and helpful - they gave us tips on how we...,2020-04-21 14:53:14
1408,Twozone Chicken,HvaKhiJtuLag0ZlXosYNUw,5,Twozone was by far one of the best boneless Korean fried chicken places I've had in the states. The meat was super soft and tender and not too greasy and...,2020-08-01 22:48:42
1409,Twozone Chicken,HvaKhiJtuLag0ZlXosYNUw,5,My favorite KFC in the area! I've tried tons and I've to say - their quality is truly the best. Super crispy skin and juicy chicken. Got delivery and the...,2020-09-06 14:02:30
1410,Twozone Chicken,HvaKhiJtuLag0ZlXosYNUw,5,"Twozone Chicken fulfills my fried chicken craving every time. I usually pickup to-go or order through a delivery app, although I have eaten at the...",2020-04-18 22:00:49
1411,RIKE,JyRCzER-tCbiB7d11-dKpQ,5,"Stopped by to support a small business toughing it out through the 2020 hellscape, and damn this shit was good. Really funky, creative flavors with...",2020-12-09 21:11:54
1412,RIKE,JyRCzER-tCbiB7d11-dKpQ,3,I still stand by my original post that I really loved the bento the first time I tried it. I went there again to try the original onigiri set and I think I...,2020-11-13 01:38:15
1413,RIKE,JyRCzER-tCbiB7d11-dKpQ,5,The food is amazing! I was born and raised in Japan and this is one of the few places in LA that serves authentic Japanese food.,2020-12-04 14:06:44
1414,n/naka,tDeuHjIUJrHeELrKEekXtA,5,"Covid are some crazy times, but luckily, you can no experience this 2 Michelin Star restaurant! It seems they're rotating their set bento boxes every few...",2020-12-04 23:51:43
1415,n/naka,tDeuHjIUJrHeELrKEekXtA,5,A special take-out treat. $65 California Ekiben. A Collab benefit for the California Community Foundation's Wildfire Relief Fund. Another good reason to...,2020-11-26 10:42:39
1416,n/naka,tDeuHjIUJrHeELrKEekXtA,5,"Although I'm sad that the regular bento box was sold out, we did luck out being able to try their box by Chef Susan Yoon. The pickup was fairly easy and the...",2020-12-12 21:04:49
1417,ShaBuShi,7BZjZLN-YDmFb4Y3N-3aJw,5,"This place is one of my favorite Shabu restaurant since pandemic.

Service: really good!!! Aff and Rap both of them are nice friendly, helpful server

Food:...",2020-09-19 12:07:32
1418,ShaBuShi,7BZjZLN-YDmFb4Y3N-3aJw,5,"Since Covid19, they set up the island in the middle of parking lot for dine in. Cozy and safe. Food is good as always. Seem to have new menu with lots of...",2020-10-31 01:36:47
1419,ShaBuShi,7BZjZLN-YDmFb4Y3N-3aJw,5,"Updated post:

With covid it's understandable that a restaurant is under more stress and make mistakes especially when delivery apps are thrown into the...",2020-09-05 20:44:22
1420,The Rooftop by JG,RQoD2ucHJJQpCevVNPlLxQ,5,"Gorgeous, literally such a beautiful ambiance. The photos do not do it justice. 

Highly recommend making a reservation via OpenTable. Upon check in we were...",2020-10-20 21:39:31
1421,The Rooftop by JG,RQoD2ucHJJQpCevVNPlLxQ,4,"Loved trying this restaurant out, especially during COVID times. The restaurant is outdoor on the rooftop (duh!) so there's plenty of airflow. The staff is...",2020-11-30 18:54:06
1422,The Rooftop by JG,RQoD2ucHJJQpCevVNPlLxQ,5,"Came here for my friend's birthday celebration and the rooftop by JG is absolutely the right place!

They offered a different menu during COVID which means...",2020-10-19 13:02:49
1423,Spoon By H,WEf8lpukPEwKTuc6mYolRA,5,I first heard of this restaurant in 2019 from Dave Chang and he could not stop talking about it. Fortunately the hype is real and Spoon by H is absolutely...,2020-12-09 15:54:30
1424,Spoon By H,WEf8lpukPEwKTuc6mYolRA,5,"COVID TAKEOUT REVIEW - 

Mom & Pop owned and highly praised by media companies like Buzzfeed, Eater, and Michelin Guide (no awards distributed this year,...",2020-11-07 14:02:33
1425,Spoon By H,WEf8lpukPEwKTuc6mYolRA,5,"Carefully crafted and well thought-out dishes = THE YUMMIEST FOOD EVER

I've heard soooo much hype about Spoon by H, particularly through Buzzfeed's Worth...",2020-10-19 18:38:26
1426,Marino Restaurant,QEGYtRXGlpuco8jE7u0tGw,5,"I've eaten here before, it's a favorite (I can't believe I haven't yelped it).  This place has history, it's family owned and run and the food & service is...",2020-09-25 16:08:41
1427,Marino Restaurant,QEGYtRXGlpuco8jE7u0tGw,5,So good to be able to get out and have a relaxing and delicious dinner at one my favorite spots in LA. Mario and team did a GREAT job making us feel...,2020-06-06 09:46:26
1428,Marino Restaurant,QEGYtRXGlpuco8jE7u0tGw,5,What a nice setup. I enjoyed the ambiance of lights and sail covering. Very cozy with proper social distance.  Love the food. Great service.  I would...,2020-09-19 22:00:25
1429,Tsubaki,Aq1vM8LCcb8mdpCOKCdlsw,5,We love tsubaki! I'm Japanese. This food is the real deal. It is the closest thing I can find to Japanese food you find in Japan but in LA (but somehow they...,2020-07-27 12:56:04
1430,Tsubaki,Aq1vM8LCcb8mdpCOKCdlsw,5,Tsubaki keeps hitting it out of the ballpark. There aren't many tables on the sidewalk but you can order online and pick up curbside.  The new pastry chef...,2020-12-02 22:32:09
1431,Tsubaki,Aq1vM8LCcb8mdpCOKCdlsw,5,"Best meal of the year, hands down! 

Just finished the Koji marinated Jidori chicken for two, which included a whole chicken, potato salad, green bean...",2020-10-23 18:45:51
1432,DeSano Pizza Bakery,fD4ntpbf92ufSHn5tSmSxA,5,DeSano Pizza Bakery is hands down one of the best places to get a Neapolitan pizza in SoCal. I put it right there at the top with Pizzana and L'Antica...,2020-11-09 19:23:32
1433,DeSano Pizza Bakery,fD4ntpbf92ufSHn5tSmSxA,5,"Sometimes a cheap pizza chain doesn't do the job, and DeSano is a great spot to get quality pizza! For three people, we ordered the Margherita Classica...",2020-10-12 15:17:58
1434,DeSano Pizza Bakery,fD4ntpbf92ufSHn5tSmSxA,5,"I have been wanting to try Desano for such a long time and finally tried it during this COVID-19 lockdown (support your local businesses) :). 

I placed a...",2020-05-14 15:56:13
1435,Birdies,eXZyAF5Xk1u-d9vnkeNPXg,5,I've been here 50 million times and they've always been good but I got takeout last night because of covid and when I say it was the BEST I've ever had from...,2020-04-25 11:30:37
1436,Birdies,eXZyAF5Xk1u-d9vnkeNPXg,5,"Love their donuts and fried chicken. Usually had their donuts. Today, Just ordered delivery of their wings with lemon pepper dry rub. So tasty! Available...",2020-09-12 18:07:18
1437,Birdies,eXZyAF5Xk1u-d9vnkeNPXg,5,"I am IN LOVE with Birdies!! If they were 24 hours, I WOULD BE BROKE.  
I ordered the 5 pc  chicken ""bites""... These things most have been on steroids......",2020-10-25 20:15:35
1438,Burrata House,lNE4CZLrLXRPhqi7KcyjfA,5,"Never tried burrata before coming here but now I really love it!!! It doesn't taste too heavy but it's superrrrrrrrr creamyyyy. 

 BH-olognese - the cheese...",2020-10-23 13:33:18
1439,Burrata House,lNE4CZLrLXRPhqi7KcyjfA,5,"The basil and tomato pasta was absolutely delicious! You could taste the freshness of the tomatoes and basil in each bite. 
The crudo panini had a nicely...",2020-11-02 23:05:07
1440,Burrata House,lNE4CZLrLXRPhqi7KcyjfA,5,"Never had burrata before this but I love it! It's so creamy and soft and goes well with everything. 

I got the signature pesto and the crudo panini. The...",2020-09-03 13:53:00
1441,Fish Grill,1--e5dJFAL0aSHuHTxHsNw,5,This is my 2nd time I've had delivery from this restaurant...always pretty speedy delivery and the food is sooo good!  Highly recommended and looking...,2020-05-06 16:28:17
1442,Fish Grill,1--e5dJFAL0aSHuHTxHsNw,5,This is a great restaurant to dine in at now due to COVID-19 as they have several outdoor tables available.  I love getting the red snapper salad with...,2020-08-10 20:30:09
1443,Fish Grill,1--e5dJFAL0aSHuHTxHsNw,5,"Great customer service & 
Delicious food !!!!!!! 
My favorite is the salmon plate with rice pilaf and grilled zucchini! My moms obsessed with the...",2020-07-07 19:25:03
1444,Bao Hiroo,ammtFdUbqDBLCmIwuV87MA,5,"Honestly have always been a fan of Bao Hiroo but since quarantine started I've definitely become a bigger fan!

Besides all the delicious baos, my favorite...",2020-05-28 20:24:25
1445,Bao Hiroo,ammtFdUbqDBLCmIwuV87MA,5,"We first stopped by when it opened, and then during the pandemic we have been ordering take out every weekend... So this review is really long overdue.  I...",2020-05-24 21:06:28
1446,Bao Hiroo,ammtFdUbqDBLCmIwuV87MA,5,"I love love love their Brussels sprouts. I just needed a veggie to compliment my steak. And I knew Bao Hiroo's Brussels Sprouts would be perfect!! 

I...",2020-05-27 16:05:44
1447,Bo Daddy’s BBQ,ImWjgRhcohdWYTPUt4iaZw,5,"OMG! Bo Daddy's is by far thee best BBQ in L.A.!!  EVERYTHING on the menu is homemade, authentic, and so delicious! The BBQ sauces are rich and...",2020-12-01 22:53:33
1448,Bo Daddy’s BBQ,ImWjgRhcohdWYTPUt4iaZw,5,"Never fails when you see a small sketchy looking spot, the food is amazing. Saw multiple good reviews and headed that way. Was open for take out only (not...",2020-07-13 13:27:01
1449,Bo Daddy’s BBQ,ImWjgRhcohdWYTPUt4iaZw,5,"Been here a handful of times now, and it's without a doubt the best barbecue in LA. Bo is a great guy and more than generous with portions. Highly recommend...",2020-10-11 19:38:59
1450,Little Pine,4B_hWagBKAMcsotnnoH30Q,5,"The outdoor seating looks so nice. I loved the lighting, table setup, and the vibe. 

Their service was quick and pleasant. Street parking is easy to find...",2020-11-08 14:21:28
1451,Little Pine,4B_hWagBKAMcsotnnoH30Q,5,"My dad and I were talking about the best dishes we've ever had and over a year later, I reminded him of the chocolate chip cookie we had here. Undoubtedly,...",2020-07-05 16:52:09
1452,Little Pine,4B_hWagBKAMcsotnnoH30Q,5,"(Took Out 02/28/20 FR @ 6:30pm): Moby's little restaurant I've pined for since it first opened!

I've been a fan of activist/DJ/musician extraordinaire Moby...",2020-03-22 14:57:20
1453,Tocaya - DTLA,28HzNE8LVC3KZ1jKvAc8hg,5,"Was visit LA and found this gem next to Starbucks!

Food 5/5: I purchased a taco and a fajita bowl. The bowl was larger than I imagined and it was...",2020-10-23 20:26:15
1454,Tocaya - DTLA,28HzNE8LVC3KZ1jKvAc8hg,5,"Don't know about these recent comments but I pick up from this location every 2 wks and my food has been consistent in quality and taste. 
I'm always...",2020-09-16 19:38:13
1455,Tocaya - DTLA,28HzNE8LVC3KZ1jKvAc8hg,5,I ordered through Postmates and I am so glad I ventured out and tried something new. I'm exploring the vegan world and there are few places that provide...,2020-04-24 21:14:49
1456,Don Felix Restaurant,44CcUoVtPhL5eFKjxnzzTA,4,"I really like this place. The food is authentic and stuff is always nice. Currently there is only pick up and no dine in.
Love the bread and green salsa, I...",2020-10-15 20:03:57
1457,Don Felix Restaurant,44CcUoVtPhL5eFKjxnzzTA,5,"Been going to Don Felix for over 10 years now and it's such a great little spot! Definitely recommend the tallarin de carne, lomo saltado and pollo al vino....",2020-11-18 23:43:53
1458,Don Felix Restaurant,44CcUoVtPhL5eFKjxnzzTA,5,"I heard so much about this place and now it was time to see what the chatter was all about!
The food was excellent! I had the #51 a.k.a. Pescado A La...",2020-10-04 07:32:47
1459,La Barca Restaurant,FBRxoQSWtziiU_A5tscVGA,4,I really like the food  here. I came here for a friend bday dinner and it was ok besides the flys. We had to sit outside of course because of COVID-19. I...,2020-10-21 11:20:49
1460,La Barca Restaurant,FBRxoQSWtziiU_A5tscVGA,4,"It's been a while since I been here. I remember going here back in the day. I used to take dates here because it was really comfy, casual and they had...",2020-03-23 06:51:53
1461,La Barca Restaurant,FBRxoQSWtziiU_A5tscVGA,5,"I love this place. Great atmosphere and service. Very good value for margaritas-- inexpensive but tasty, and I can really taste the tequila, especially on...",2020-05-31 15:15:56
1462,Ramen Hood,-dqkgjUUIDOb4V1dC4X70A,5,"The bomb.com. Always a favorite spot, even since I moved out of the neighborhood. 

Spicy ramen, ftw! Their broth is soooo decadent. Mmmmmm

Order take out...",2020-12-04 18:59:31
1463,Ramen Hood,-dqkgjUUIDOb4V1dC4X70A,5,Vegan ramen? Is that really possible? I was really skeptical to hear that ramen could be made vegan and still taste authentic to it's non-vegan counterpart....,2020-08-09 13:56:34
1464,Ramen Hood,-dqkgjUUIDOb4V1dC4X70A,5,I was beyond excited to try this place! Extra excited because IT'S 100% VEGAN! I repeat a 100% VEGAN RAMEN place! The staff was super nice! My visit was for...,2020-04-30 12:09:59
1465,Quebobs Restaurant,-bHFEUV0DjYy8_rV5zY-2g,5,"This place is a gem! I went to pick up food for the first time and ordered the chicken kabob, tabouli, salad, rice, side of hummus, and pineapple ginger...",2020-10-20 17:44:25
1466,Quebobs Restaurant,-bHFEUV0DjYy8_rV5zY-2g,5,Best Mediterranean food in LA outside of Greece! I stumbled on this hidden gem from a coworker that was eating a dish from here that looked smelled amazing....,2020-08-17 20:26:21
1467,Quebobs Restaurant,-bHFEUV0DjYy8_rV5zY-2g,5,Randomly ordered from this spot on a whim and it ended up bein such a hidden gem! I got the chicken kabobs and my sister got the surf n turf kabobs and...,2020-12-13 13:17:05
1468,Cafe Creole,uPeWc6p4KLMHRve4OlLVEg,4,The portion sizes seemed a bit smaller than you would hope for based on priced. There are six medium shrimp for the shrimp and grits. Unfortunately no grits...,2020-06-25 20:39:00
1469,Cafe Creole,uPeWc6p4KLMHRve4OlLVEg,2,"-It took well over 20min for 2 orders (shrimp poboy combo & fried shrimp basket). 

-Service was not professional (talking to cook/helpers while we are...",2020-06-27 13:47:30
1470,Cafe Creole,uPeWc6p4KLMHRve4OlLVEg,2,"Sits in the Crenshaw mall...the end.
Just kidding. Lol. Let me keep this short and sweet.
Customer service was confusing. Young man originally working cash...",2019-11-08 15:43:56
1471,HiHo Cheeseburger,Z31Vy7P8B5y7gIw0fYeUGg,5,"I love HiHo's burgers! The beef is amazing. I usually get the HIHO DOUBLE CHEESEBURGER with a side of FRIES.

This location is currently the closest to me,...",2020-07-04 10:15:29
1472,HiHo Cheeseburger,Z31Vy7P8B5y7gIw0fYeUGg,5,"I've been looking to try HiHo Cheeseburgers for a while now, but had to wait until my recent trip to the US to have one.  Well, wouldn't you know it, but it...",2020-03-26 20:52:40
1473,HiHo Cheeseburger,Z31Vy7P8B5y7gIw0fYeUGg,5,"I'm gonna go out on a limb here and say best cheeseburgers in LA. I enjoy Umami, and sometimes the occasional animal style In N Out burger when I feel like...",2020-11-25 00:17:05
1474,Eggslut,BZcPwijPRqY7tynRzt2UTA,5,"Still love this cool little egg spot. Ordered a ""Slut"" to-go and to my surprise, they were still serving them so I was really happy. 

As far as what to...",2020-10-24 11:48:58
1475,Eggslut,BZcPwijPRqY7tynRzt2UTA,5,One day I decided to have a good breakfast and ordered the delivery from Eggslut. I've heard a lot about this place that's why I ordered Fairfax and fresh...,2020-11-16 10:05:12
1476,Eggslut,BZcPwijPRqY7tynRzt2UTA,4,"Finally got to try Eggslut for the first time after hearing about it for years and I think that it was definitely good, but it is a victim of its own hype....",2020-11-11 16:45:36
1477,Little China,-RB75P7rg6Jyp8ZMegSmCA,5,Totally missed it and didn't even realise a new place opened up in this spot. I live around Windsor Square which is out of the way for most Korean-Chinese...,2020-05-18 11:48:38
1478,Little China,-RB75P7rg6Jyp8ZMegSmCA,5,I ordered the shrimp fried rice and the fried shrimp with garlic sauce. Both were really good! The sauce came separately from the fried shrimp so when I...,2020-08-29 14:44:29
1479,Little China,-RB75P7rg6Jyp8ZMegSmCA,3,"Pretty good Korean Chinese food in Windsor Square. 

Although we live near Ktown, the Windsor Square neighborhood is usually at least a drive to get the...",2020-08-07 13:08:09
1480,Koreatown Galleria,aut_WzNF3TutzbX-OfWVpw,5,"The amount of times I've PASSED THIS MALL IS CRAZY!!!! I never knew this was a mall, just a random building which I never paid any attention to. Granny and...",2020-09-26 18:28:09
1481,Koreatown Galleria,aut_WzNF3TutzbX-OfWVpw,4,"We were hungry and on our way to a Korean spa in late January, so someone looked up this place. I'm a big fan of food courts when traveling with a large...",2020-06-26 01:33:28
1482,Koreatown Galleria,aut_WzNF3TutzbX-OfWVpw,1,I purchased a box of Korean grapes for ($19.99) this evening to find out they had mold growing inside indovidual bags (see photos). This is not the first...,2020-10-19 21:11:03
1483,Mr Fries Man,LruRPzJ1nOS3_04LV1HAUA,5,"Welcome new stores in 2020!! I know it's so hard to open a new store this year. They just opened a week ago, so the pics here are so few. I'd like to input...",2020-11-27 09:36:47
1484,Mr Fries Man,LruRPzJ1nOS3_04LV1HAUA,3,Ok so this location just recently opened and since I have been to one of the other locations before I figured I'd try this one. I didnt remember much about...,2020-11-18 20:31:41
1485,Mr Fries Man,LruRPzJ1nOS3_04LV1HAUA,5,Delicious!  Tried the shrimp and crab with lemon sauce.  Shrimp and crab were fresh and tasty.  Fries were crisp on the outside and tender inside.  Strongly...,2020-12-12 19:51:53
1486,Neri's,eIip70AtYPjJsC4kh1uTjg,5,"Due to COVID I'm not able to go home and get my Mom's home cooking. Well,  Neri's came close to moms cooking! I loved it all. I ordered the sinigang,...",2020-07-29 18:47:18
1487,Neri's,eIip70AtYPjJsC4kh1uTjg,4,Have ordered take out here a couple of times and I think the food is on the better side of average for Filipino food.  The lumpia was delicious but the...,2020-08-06 19:22:22
1488,Neri's,eIip70AtYPjJsC4kh1uTjg,5,"SUUUUCH GOOD FILIPINO FOOD!!! 

My filipino friend took me here saying the food was dank, and I'm SO glad I decided to go along with her! 

I don't really...",2020-01-04 19:11:15
1489,Fogo de Chão Brazilian Steakhouse,-urNLXq1RYUDAy5XCWLaqQ,5,We love fogo. This has been an amazing experience even in a pandemic. The staff are so nice and attentive. Everyone is wearing masks and face shields. They...,2020-10-30 19:48:20
1490,Fogo de Chão Brazilian Steakhouse,-urNLXq1RYUDAy5XCWLaqQ,5,My wallet took a huge hit after this one but boy was this an experience. The food never. stops. coming. I don't know what a non-COVID trip to Fogo de Chao...,2020-06-30 21:53:08
1491,Fogo de Chão Brazilian Steakhouse,-urNLXq1RYUDAy5XCWLaqQ,5,Great food and great service. My spouse and I made a reservation. Because it was a chilly night we requested a table close to the heating lamp. The servers...,2020-10-28 23:05:11
1492,Oh My Crab,DJWMXLbhweA65pAg0-6ZVQ,5,Another great crab spot in Koreatown! I gave this a shot when Boiling Crab To-Go was too busy to do pickup and boy did Oh My Crab deliver (LITERALLY!). My...,2020-11-14 19:48:44
1493,Oh My Crab,DJWMXLbhweA65pAg0-6ZVQ,5,Great service! Friendly staff. Got the food ordered on Chow Now as promised. Go to their website for the menu. Food was yummy. Fresh seafood. Got combo 1 w...,2020-10-30 15:08:48
1494,Oh My Crab,DJWMXLbhweA65pAg0-6ZVQ,5,"What a TREAT! This wonderful spot had the courage to open during COVID  after tasting their food, I see it wasn't courage as much as plain common sense. We...",2020-11-21 19:28:05
1495,LAces,C_8Y_wwGFummtQ3OQLRjcg,5,"Was looking for a spot around ktown to meet up a friend and watch the Laker game at the same time. Stopped by on September 24, 2020 at around 5pm and the...",2020-10-15 12:06:21
1496,LAces,C_8Y_wwGFummtQ3OQLRjcg,5,So finally got a chance to try this place out after living in the area for about 8 months.  Such a shame the pandemic happened because this place is...,2020-08-08 18:12:58
1497,LAces,C_8Y_wwGFummtQ3OQLRjcg,5,"I was waiting for months for this sports bar to open up and it finally did so I had to come! 
Even though it's during covid, they've made the patio/parking...",2020-08-23 09:15:12
1498,Swift Cafe,tWkqjOEcoDuh5hvMdRSa7Q,5,Such a great spot to go and grab lunch or breakfast. Located on Crenshaw in Leimert Park. Easy to find and even though it's in a high traffic area I quickly...,2020-08-30 15:58:00
1499,Swift Cafe,tWkqjOEcoDuh5hvMdRSa7Q,5,Swift Cafe opened up around the corner from my house and I never got a chance to go inside pre-COVID. I ordered via postmates and I was pleasantly surprised...,2020-11-24 00:01:57
1500,Swift Cafe,tWkqjOEcoDuh5hvMdRSa7Q,5,"I've been wanting to try Swift for months and I'm mad I waited this long to eat here. Listen, the atmosphere, menu, and food is BOMB. My palette has to be...",2020-11-09 00:33:14
1501,Boo's Philly Cheesesteaks - Koreatown,GBwagy_9bBmyiSETCbYnkg,5,"When you think Koreatown, you automatically imagine yourself nestled in a crowded room, a soft hazy covering of smoke and the sounds of sizzling meat on a...",2020-09-11 20:45:46
1502,Boo's Philly Cheesesteaks - Koreatown,GBwagy_9bBmyiSETCbYnkg,5,"This sandwich hit ALL the right spots, and then some. I have been following Boo's for a while on Instagram, but since I'm from the Bay Area, I was never...",2020-10-01 21:18:40
1503,Boo's Philly Cheesesteaks - Koreatown,GBwagy_9bBmyiSETCbYnkg,5,"Always great, weird with the new covid rules but still great food.. Try it with full double meat & cheese and thank me later ;)",2020-11-13 16:51:30
1504,Creamo Silverlake,S5O8oZX29WF68DrfWaNNUA,5,I love Donut Friend so I was really excited to try Creamo and it did not disappoint. Unfortunately when we popped in on a Sunday evening they were actually...,2020-10-15 04:54:00
1505,Creamo Silverlake,S5O8oZX29WF68DrfWaNNUA,5,So many amazing vegan ice cream options!! I can't wait to come back post-COVID so I can sample some flavors! I ordered the Bananniversary Milkshake and...,2020-09-10 13:56:54
1506,Creamo Silverlake,S5O8oZX29WF68DrfWaNNUA,5,"BEST. VEGAN ICE CREAM. EVERRRR.

Sooo glad I found this place. I can eat anything here and not have to ask, ""is this dairy-free?"" 

The ice cream flavors...",2020-09-03 09:34:47
1507,Toca Madera,LNb-ElJwKIXS6Lx5xdRB1Q,5,"I have been year many times ever since I moved to LA 3.5 years ago, and I will forever love this place. Due to the pandemic, we are only limited to outdoor...",2020-10-11 18:51:57
1508,Toca Madera,LNb-ElJwKIXS6Lx5xdRB1Q,5,Gosh! Everything is perfect here... Covid restrictions and all. I want to start of by saying this place is beyond beautiful. The outdoor seating is done so...,2020-10-27 21:33:06
